text,label
vì có vo uc he r shop e e xu nên mua đc giá khá rẻ,1
chất_liệu vải mềm,1
đúng với mô_tả đẹp,1
chất_liệu tốt,1
"lin k v t de doi diem thanh luu luong dat a , phut goi , sms hoac cac uu dai gia tri khac",1
áo phom rộng_rãi và thoải_mái,1
"giao hàng cũng nhanh tầm , ngày là có hàng",1
ví_dụ như hương mật tựa khói_sương,1
tuy là giao hàng hộp về hơi méo nhưng chất_lượng thì đỉnh lắm nha,1
công_dụng màu k đẹp như hình nó hơi nghiêng hồng hồng sao ý,1
đúng với mô_tả đúng,1
đúng với mô_tả đúng,1
sản_phẩm được lắm chị chủ shop phải nói là tuyệt_vời ông mặt_trời mình kg mà mặc vào y_như_rằng là kg rất ổn,1
đúng với mô_tả,1
chất_liệu ok,1
"bạn nào muốn mặc dà y , to rộng nên cân_nhắc",1
chất_liệu tốt,1
"mua cả ship có k , tưởng giao cái hộp k ai_ngờ hàng thật đóng_gói ổn",1
màu_sắc đúng,1
dép đẹp lắm nha nhưng tui mua sie to nhất rồi mà vẫn bị chật những bạn chân mà to thì nên lưu_ý nha,1
"đúng với mô_tả vải hơi mỏng nha mọi người , còn rom mặc vô thì đẹp lắm",1
chất_liệu cao_su dẻo,1
túi đáng đồng tiến bát gạo quá,1
đúng với mô_tả đúng mô_tả,1
chất_liệu ổn,1
chất_lượng sản_phẩm tốt,1
đúng với mô_tả đúng,1
tốt đ,1
đúng với mô_tả đúng,1
đẹp như hình,1
đúng với mô_tả đúng,1
chất_lượng sản_phẩm tuỵ t ời giao hàng nhanh cái loay_hoay mãi ms lắp được,1
nhưng dc cái hình in đẹp,1
dc ok,1
hỗ_trợ khách_hàng ko nhiệt_tình,1
đúng với mô_tả giống in hình,1
hàng đúng như hình,1
giao đứng hơi bị đẹp mình đã mua lại cai nữa,1
chất_liệu tốt,1
chất_lượng sản_phẩm,1
shop giao nhanh,1
mình sẽ sử_dụng thử một thời_gian,1
đúng với mô_tả đúng,1
màu đẹp giao hàng nhanh đóng_gói kĩ_càng tốt mn nên mua nha hình_ảnh mang tính_chất nhận xu,1
kết_nối với điện_thoại thì ok,1
độ bền màu tốt,1
tính_năng nổi_bật k có,1
"đúng với mô_tả cũng đúng , n h mà k êm lắm , đ nên cũng k dám nói dì nhìu",1
đúng với mô_tả đúng,1
chất_liệu tốt,1
ship hàng nhanh,1
đúng với mô_tả đúng với mô_tả,1
hàng khá ok,1
độ bền màu ổn,1
"nói_chung cx ổn , áo có vết sứt , áo đẹp đối_với m thì hơi rộng , các bạn cx nên thử",1
"nên mua nhỏ lại si e , sau_này còn gián ra nữa a",1
"rcm mọi người mua a , rất đáng_giá tiền",1
đóng_gói cẩn_thận,1
"đi dc hôm thì bong hic hơi tiếc lần trước mua shop khác đi dc bền với lâu hơn , mềm hơn nhưng cái này hơi cứng nhưng tạm dc nha tiền rẻ dùng tạm",1
đúng với mô_tả đúng in,1
nói_chung là rất ưng nên mua nhà mọi người mình săn được đôi này giá chỉ k thôi,1
đúng với mô_tả đúng,1
đúng với mô_tả yet,1
mik thấy ổn,1
chất_lượng sản_phẩm tốt,1
lần sau ủng_hộ tiếp,1
rùng tốt,1
giá ổn lưu hương cũng ok mùi khá thơm t xo di sua iu o uo xo y i dit s,1
đúng với mô_tả đẹp nha,1
"đẹp , xịn xó , rẻ , bổ , b na ke ka mm cs am s s k sn b d b d n d d k k d k d k d",1
sản_phẩm tốt như hình,1
"thay cung phát bt , nhung chất luong về sau bik bix co bền hay hok",1
độ bền màu bền lắm nha mấy bà,1
chất_lượng sản_phẩm tốt,1
chất_liệu bền,1
sản_phẩm phù_hợp với giá tiền,1
chất_lượng sản_phẩm sản_phẩm ổn,1
nhưng_mà giá này như đôi này là hợp_lí rồi,1
chất_liệu bền,1
giao đủ cho mình nhìn xinh lắm lun có_điều hơi to quá so với mình ha_ha,1
chất_lượng sản_phẩm oke,1
chất_liệu tốt,1
trông oke lun,1
đúng với mô_tả đúng,1
màu_sắc ok,1
"mp cho tất_cả các thiết_bị pc , ma c , an d roi d , ios",1
"lúc mới cầm vào áo nhẹ lắm nhưng_mà mặc vào thì đổ mồ_hôi hột luôn , rcm mng mua rất rất nhìu",1
đúng với mô_tả đúng,1
ok,1
chất_lượng sản_phẩm dùng tốt,1
mới_đầu sợ vì mik mua k nhưng ko ngờ nó đẹp hơn trên hình ý,1
đã nhận hàng ok,1
chất_lượng sản_phẩm tốt,1
chất_liệu cao_su dẻo,1
sản_phẩm tốt,1
chất_liệu ok,1
chất_liệu ổn với giá tiền,1
đ mua được tai nghe kết_nối được blu eto ot h,1
chất_lượng sản_phẩm tốt,1
"giao hàng n h anh , xứng_đáng sao ạ",1
đúng với mô_tả đúng với mô_tả,1
mn nên mua thử nha,1
đúng với mô_tả đúng,1
c in ad xe an,1
màu_sắc y hêt,1
luv shop,1
"shop đóng_gói cẩn_thận , giao hàng nhanh",1
quá đi thôi hu_hu hu hi_hi,1
đúng với mô_tả đẹp,1
giao hàng nhanh,1
ổn nha mặc_dù hơi mỏng nhưng cho shop sao,1
màu_sắc trăng,1
chất_liệu đúng,1
đúng với mô_tả đúng,1
chất_lượng sản_phẩm d deh p,1
chất_liệu tot,1
màu_sắc ok,1
giao hàng nhanh shipper thân_thiện,1
đúng với mô_tả đúng,1
dép rất đẹp luôn giao lại còn nhanh tuy_nhiên n bị mất cái phom dáng lúc đầu nên phải cho giấy chống sốc vô để có lại phom,1
shop đóng_gói sản_phẩm cẩn_thận lắm ạ,1
đúng với mô_tả đúng,1
đúng với mô_tả đúng,1
nói_chung nên mua,1
màu_sắc trắng đẹp,1
chất_liệu mềm,1
nhuộm là bóng mịn,1
chất_lượng sản_phẩm cũng tốt,1
chất_liệu long,1
đúng với mô_tả chắc v,1
độ bền màu ok,1
đúng với mô_tả đúng,1
mn nên mua thử,1
màu_sắc xanh đậm,1
cho shop sao,1
"chào_mừng bạn đến với bảng nhớ tạm của g boa r d , bất_kỳ văn_bản nào bạn sao_chép sẽ được lưu tại đây",1
đúng với mô_tả đúng,1
đúng với mô_tả đúng với mô_tả,1
giao hàng nhanh,1
tôt,1
với mức giá này thì tất_nhiên chả mong_đợi quá nhiều,1
giao hàng nhanh,1
công_dụng để đánh lên môi và làm_đẹp,1
tốt nhất rẻ đánh_giá nhận xu ảnh minh_hoạ nên mua rẻ nhất thị_trường hiện_nay với giá k ko bàng cải nhiều,1
chất_liệu tốt,1
đúng với mô_tả giống hình,1
đúng với mô_tả đúng sie,1
đẹp nhưng_mà phần dây xỏ nên làm bằng dây cước thì chắc_chắn hơn,1
à mình mới mở shop các bạn ghé shop mình nha,1
chất_lượng ban_đầu thì ok,1
chất_lượng sản_phẩm đúng mô_tả,1
chất_liệu ok,1
tính_năng nổi_bật giao hàng nhanh tầm ngày là tối,1
rẻ so với chất_lượng,1
"đúng với mô_tả không bị lỗi , giao hàng nhanh ạ",1
đúng với mô_tả đúng,1
giao hàng không đúng mẫu đặt nhưng dép đẹp lắm,1
màu_sắc đ ẹo,1
màu_sắc ok,1
chất_lượng sản_phẩm ổm,1
độ bền màu tốt,1
ok,1
"shipper nhiệt_tình , h tối giao giao giờ phù_hợp",1
chất_liệu tốt,1
màu_sắc đúng như hình,1
đúng với mô_tả đúng,1
đúng với mô_tả đúng,1
đúng với mô_tả,1
"sản_phẩm ok , giao n h anh , chất_lượng , bị hơi sau khi mở",1
tính_năng nổi_bật có led tai mèo,1
dép đi êm chân,1
đúng với mô_tả tốt,1
ship bơ giao hàng nhanh,1
"đóng_gói kỹ , mùi nhẹ nhưng lưu hương không lâu lắm , khoảng h , giá siêu rẻ video không liên_quan đến sản_phẩm",1
chất_liệu tốt,1
đúng với mô_tả đẹp,1
chất_liệu tốt,1
để xài lâu_dài xem sao,1
kem đặc_trị mụn trắng da c trị hết sạch mụn các loại mụn,1
với giá này thì nên mua nha,1
đúng với mô_tả tốt,1
đúng với mô_tả hàng k đẹp,1
màu_sắc xanh rêu màu đẹp,1
"đẹp nha , nhưng hình_như vải hơi xuyên thấu",1
còn đc tặng chun tóc,1
"chỗ đeo có phần hơi lỏng lẻ o , nma chất_lượng cao so với giá nhé",1
màu_sắc,1
vải hơi mỏng nhưng vs giá tiền thì tạm ổn nói_chung là ok,1
"giao hàng n h anh , túi đẹp so với giá , hình_ảnh và video mang tính_chất nhận xu",1
chất_lượng sản_phẩm tốt,1
chất_liệu ok,1
hàng đúng hình,1
"n na k sb sn s s k sn s m s m s mam am am an an sn s s h s h x h x h d h h s s k s k s k s k s k s k s s dễ xù đó mà xinh , mùi hơi thúi",1
giao hàng nhanh,1
đúng với mô_tả đúng,1
đúng với mô_tả khá,1
đúng với mô_tả tốt,1
đúng với mô_tả giống hình,1
chất_lượng sản_phẩm tốt,1
đúng với mô_tả đúng,1
đúng với mô_tả đúng,1
chất_lượng sản_phẩm đúng,1
đúng với mô_tả đúng vs ảnh của shop mô_tả,1
sẽ tiếp_tục ủng_hộ shop,1
áp mã giảm_giá còn k quá tuyệt_vời,1
đúng với mô_tả đúng,1
ship e r ổn nha đặt tên r anh vẫn giao đc tận nhà,1
đúng với mô_tả đúng,1
đúng với mô_tả đúng với miêu_tả,1
đáng tiền,1
chất_liệu bền,1
với giá k thì cũng k mong_đợi quá nhiều,1
"với giá đó thì quá ok rồi ạ , mình m mắc hơi ngắn tý nhưng nên mua nha mn , màu hơi khác ảnh tí hiu hi i",1
chất_lượng sản_phẩm đúng,1
chất_liệu tốt,1
chất_liệu vải mềm,1
với giá tiền như này,1
đóng_gói hơi sơ_sài dáng chuẩn ok lắm có_thể tham_khảo,1
chất_lượng sản_phẩm tốt,1
đúng với mô_tả đúng,1
chất_liệu tốt,1
đúng sie đúng mẫu vận_chuyển nhanh tot t,1
uy_tín,1
dép mang êm giao hàng nhanh,1
mùi hương đầm nhẹ,1
đúng với mô_tả ổn,1
hàng hơi mốp một xíu nhưng cũng rất hay chất_lượng cao,1
lân sau ung hô,1
còn sản_phẩm thì kh có gì để chê,1
chất_lượng sản_phẩm tốt,1
đúng với mô_tả đúng,1
chất_lượng tốt đúng mẫu,1
những kiến_thức cơ_bản trong cuộc_sống là những kiến_thức để giúp con_người có_thể sống và làm_việc tốt,1
đúng với mô_tả,1
độ bền màu ổn,1
chất_lượng sản_phẩm tốt,1
đúng với mô_tả đẹp,1
đúng với mô_tả,1
đúng với mô_tả đúng,1
màu_sắc ok,1
váy hơi ngắn nma đẹp giao hàng nhanh mua đợt sa le nên rẻ lắm,1
đúng với mô_tả dung,1
cảm_ơn shop,1
chất_liệu ok,1
ôn_tập môn phân_tích bạn có_thể cả các loại máy_bay đi đà_nẵng tiếng,1
đúng với mô_tả dung,1
"hàng giao cũng g nhanh lắm mọi người ạ đóng_gói hơi cẩu_thả , bị móp nhẹ nhưng ko sao ạ hàng vẫn ổn",1
chất_liệu tốt,1
màu_sắc đúng,1
sau sẽ tiếp_tục ủng_hộ shop p,1
hình_ảnh chỉ mang tính_chất minh_hoạ đồ đẹp ok sẽ quay trở_lại ủng_hộ shop,1
đúng với mô_tả,1
rcm nên mua nha,1
đúng với mô_tả đúng,1
giao hàng nhanh,1
"đóng_gói cẩn_thận , giao hàng nhanh",1
chất_liệu tốt,1
chất_liệu tốt,1
tai nghe giống ảnh mẫu khá ổn,1
tính_năng nổi_bật ko,1
đúng với mô_tả đúng,1
đúng với mô_tả đúng,1
tính_năng nổi_bật không kết_nối được dì luôn nge ko đ ư ơ c khiên mn đừng nên mua,1
giao hàng nhanh_chóng,1
cảm_ơn shop,1
đúng với mô_tả chắc là đúng,1
chất_lượng sản_phẩm tốt,1
đúng với mô_tả đúng,1
gói hàng can thận,1
"giao hàng hơi lâu do dịch_bệnh , chất_lượng sản_phẩm ok e , âm_thanh ổn_áp , màu đẹp",1
hàng rất đẹp và tốt tuy_nhiên vải hơi mong và mặc khá là nóng,1
giao hàng nhanh,1
đúng với mô_tả đúng,1
giao hàng nhanh,1
chất_liệu ok,1
chất_liệu êm,1
áo đẹp nhưng chất mỏng cũng là c em e r y nhưng nó lạ lắm,1
đúng với mô_tả hơi nhỏ nm xinh nhắm,1
"tai nghe đẹp , kết_nối n h anh , mà mình hong biết tắt cái đèn kiểu gì á",1
áo lớp mỏng nhiều chỉ thừa nhưng với giá này là ok,1
chất_liệu da mềm,1
"mùi nhẹ_nhàng , không gây đau_đầu và buồn nồn đâu nha a",1
chất_liệu dẻo,1
đúng với mô_tả đúng,1
chất_liệu vải mát,1
tính_năng nổi_bật có_thể chỉnh lên bài khác,1
đúng với mô_tả đúng,1
chất_liệu tốt,1
tai nghe hơi nhỏ nhưng âm_thanh tốt,1
"túi thì ok nhma do vận_chuyển hay sao nên gãy mất om , bù lại túi khá xinh ship n h anh , ủng_hộ shop nhá mng",1
hài_lòng,1
xứng_đáng dc đ,1
màu_sắc đúng với yêu_cầu,1
chất_lượng sản_phẩm oke,1
sản_phẩm ok,1
tốt,1
nhưng vs giá này thì không đòi_hỏi gì nhiều,1
"bé nhà mình rất thích nhé , có_điều hàng ko giống hình có dấu chân_như hình",1
hơi lỗi chút nhưng chấp_nhận đc với mức giá nên mình vẫn cho sao,1
m ng ghé qua ủng_hộ shop nha,1
chất_lượng sản_phẩm tốt,1
đế màu trắng k cùng màu đen nhưng cũng đẹp mua được giá k ok,1
đúng với mô_tả đúng,1
màu_sắc đúng,1
và tôi đã trở_lại sau ngày sử_dụng,1
đúng với mô_tả váy xinh hơi mỏng ảnh minh_hoạ thôi mọi người nhé,1
đúng với mô_tả đúng,1
đúng với mô_tả đúng thi ệ c,1
chất_lượng sản_phẩm tốt,1
đúng với mô_tả khá đúng,1
"sản_phẩm đẹp nên mua nha , hình_ảnh chỉ mang tính_chất minh_hoạ để nhận xu",1
"áo hơi mỏng nhưng chất vải mát , sie đúng hình , giá rẻ nên ổn",1
"chào_mừng bạn đến với bảng nhớ tạm của g boa r d , bất_kỳ văn_bản nào bạn sao_chép sẽ được lưu tại đây",1
_son mịn đẹp đánh lên môi khá mướt hình_ảnh và video chỉ mang tính_chất nhận xu,1
chất_lượng sản_phẩm tốt,1
đúng với mô_tả vừa đẹp,1
"bạn nào gầy_gầy mặc rất oke nhé , orm rộng và dài , mặc với quần_đùi ổn ạ",1
đúng với mô_tả đúng với trên hình,1
lắp_ráp hơi lâu nhg mà sản_phẩm đẹ,1
đúng sie,1
"hàng về rất nhanh chỉ ngày mình đặt , như g vì ko có hộp nên đầu sục hơi méo_mó chút",1
chất_lượng sản_phẩm tốt,1
đúng với mô_tả dung,1
chất_liệu đúng,1
màu_sắc ok,1
"lớp nỉ bên trong không quá dày cũng không quá mỏng , hợp mặc mùa xuân , thu",1
nói_chung giá tiền như_vậy là quá oke,1
mọi người nếu có ai đang muốn mua thì vô shop này nhê,1
giày oke nha mng hơi lỗi xíu vs giá này thì ok nha a,1
"mùi cũng khá là thơm , độ lưu hương thấy bảo là khá lâu nhưng mình thấy chỉ hơn tiếng là hết mùi",1
đúng với mô_tả đúng,1
độ bền màu lì,1
ok,1
"mùi hơi g h ê , keo lem ra ngoài không cạy được nhưng nhìn cũng xinh lắm",1
giá rẻ,1
shop đục lỗ hơi lệch lên ghép hơi khó chút vs bị bập_bênh nhẹ nhưng ok la nha,1
"hàng đẹp , đáng tiền , nên mua ạ , hơi lệch tí",1
mùi hương cũng thom m,1
đúng với mô_tả đúng chuẩn hàng,1
sản_phẩm ok,1
đúng với mô_tả đúng,1
hình_ảnh chỉ mang tính_chất minh_hoạ nhưng sp ok,1
áo ổn với giá,1
"shop chuẩn_bị hàng n h anh , giao hàng nhanh",1
"suất sắc luôn , vải có hơi mỏng tí thật nhưng k sao với giá tiền k đòi_hỏi dì ạ",1
"ổn nha mn , nhưng hơi nhỏ đeo hơi đau , nó siết vào tai í , nhưng cũng ok , cho",1
hầu_như là ko có chỗ tắt đèn cái tai mèo đó,1
"mình mua được lúc hàng đang sa le , giá khá rẻ",1
chất_liệu ok,1
đáng tiền,1
chất_liệu tốt,1
đúng với mô_tả đúng,1
đúng với mô_tả đúng,1
áo hơi mỏng nên cân_nhắc nha a chất vải cũng kì nữa,1
"tai nghe ổn_áp mà hơi tiếc một_chút , mua hộp mà có dây kết_nối máy_tính ò",1
giao hàng nhanh ngày,1
đặt mà nó lạ lắm mn ơi,1
"áo thun gân , mỏng thì hôg quá mỏng , mặc ổn , đẹp đáng mua",1
iu,1
đúng như trong hình,1
tốt,1
shop giao hàng rất nhanh sp y hình_như da bên ngoài chiếc dép bên phải bị xước ở đầu mũi dép và bên ria nhưng giá rẻ nên sài tạm,1
"vải hơi mỏng , mặc rất thoáng , màu áo rất đẹp , có chỉ thừa nhưng tự cắt được",1
màu_sắc đúng,1
màu_sắc đúng,1
đúng với mô_tả màu xanh k đẹp,1
chất_lượng sản_phẩm ổn,1
chất_liệu tốt,1
dép đúng với mô_tả hàng đẹp,1
phù_hợp với giá tiền,1
đúng với mô_tả hàng đẹp,1
đúng với mô_tả đúng,1
chất_lượng sản_phẩm oke,1
đẹp giá rẻ rất là ưng_ý mn ue n d dien n r c k n d ba k k s k d k d k kg k k d,1
đúng với mô_tả rất_chi_là đúng,1
ai đi thì nên mua,1
thấy cũng ổn,1
độ bền màu ok,1
hàng ngon với giá k,1
đúng với mô_tả đúng,1
hi_vọng xài đc lâu_dài,1
nếu có dịp em sẽ ủng_hộ shop,1
dép đẹp si p pe r khó_tính giao hàng nhanh ok la hình_ảnh mang tính_chất nhận xu,1
ok la,1
độ lưu hương ổn,1
ship hàng nhanh,1
chất_liệu vai r xịn,1
chất_lượng sản_phẩm tốt,1
chất_liệu mềm,1
đúng với mô_tả đúng,1
đúng với mô_tả đẹp,1
dép ok hợp vs giá tiền,1
đúng với mô_tả chuẩn_y hình,1
chất_liệu vải đẹp,1
chất_liệu tot,1
vì nó đẹp nên mấy ngày đầu nó đeo suốt ngày,1
k nghĩ là giá rẻ v luôn á,1
"giao hàng n h anh , đúng rom , đúng màu đóng_gói cẩn_thận",1
đúng với mô_tả giống hình,1
đúng với mô_tả đúng với hình_mẫu,1
chất_lượng sản_phẩm tốt,1
chất_liệu nhua deo r,1
shop uy_tín,1
lần đầu mua cũng tạm được sẽ ủng_hộ shop vào lần sau nữa chất tạm được,1
độ bền màu lâu trôi,1
đúng màu_sắc khách đặt,1
chất_liệu tốt,1
xin_lỗi vì ảnh không liên_quan nhưng hàng rất đẹp hợp với giá tiền,1
đúng với mô_tả sản_phẩm chất_lượng,1
đúng với mô_tả đúng,1
đúng với mô_tả đúng,1
công_dụng làm_đẹp môi,1
đúng với mô_tả đúng,1
đúng với mô_tả đúng với mô_tả,1
màu_sắc ok,1
"đáng tiền lắm , mn nên mua ạ vd chỉ mang tính_chất nhận xu",1
ta nói chỉ k mà đc đôi dép mờ ê mê luôn sao o cho shop luôn,1
đã nhận,1
đúng với mô_tả đúng,1
chất_lượng sản_phẩm dùng rất ok nhưng chưa tắt đc led,1
chất_liệu tốt,1
độ bền màu ok,1
"đẹp , đeo hơi đau vai",1
độ lưu hương h,1
sắc nét,1
tr oii dép xinh nhắm giao nhanh ship det h săn sa le k mà dị là quá là xúc_xích,1
"hàng đẹp lắm mỗi_tội hơi kênh một_chút , lắm khá đơn_giản mình t cũng có_thể lắp được",1
chất_liệu tốt,1
chất_liệu ok,1
chất_liệu dép đẹp,1
đúng với mô_tả đúng,1
áo hơi mỏng nhưng đẹp hơi nhiều chỉ thừa d b d sn ec d k s d b d n d n,1
chất_liệu tốt,1
chất_lượng sản_phẩm tốt,1
đúng với mô_tả đúng,1
đúng với mô_tả,1
o mình ko nghĩ là loa blu eto ot h chỉ có k mà có_thể chất_lượng đến vậy cảm_ơn shop,1
chất_liệu tốt,1
đúng với mô_tả,1
_son đẹp lắm ạ video và ảnh chỉ mang tính_chất nhận xu thôi ạ,1
giao hàng nhanh,1
chất_lượng sản_phẩm tay nghe,1
orm ko đẹp lắm nhưng với giá tiền này là quá rẻ nên mua nha,1
màu_sắc đúng,1
giao hàng nhanh,1
đúng với mô_tả đúng,1
"tạm được , nên mua",1
chất_liệu da mềm,1
đúng với mô_tả đúng,1
chất_liệu ổn,1
đúng với mô_tả đúng với mô_tả,1
áo đẹp nhưng hơi mỏng,1
tai nghe cách_âm tốt,1
chất_lượng sản_phẩm tốt,1
đúng với mô_tả khá đúng,1
"với giá tiền này thì dị cũng oke e , mấy bạn lên nâng sie nha , tôi mua sie hơi chật",1
đáng_giá tiền nên mua nha,1
"sản_phẩm rất đẹp , tuy_nhiên không được chắc_chắn lắm",1
chất_liệu tốt,1
chất_liệu êm,1
hàng khá đúng chất vải ko quá dày giao hàng nhanh tầm ngày là có vs số tìn ra cũng ko đòi_hỏi phải có một cái thui_thủi một_mình để bên cạnh,1
chất_liệu tốt,1
đi đâu chơi nét à_à thế à a a cũng phải có tiền mua sạc pin đi đâu chơi không có,1
dùng cũng ok,1
đúng với mô_tả đúng,1
đúng với mô_tả đúng,1
giao hàng nhanh,1
đúng với mô_tả đúng,1
chất_lượng sản_phẩm tốt,1
nói_chung tiền_nào_của_nấy với giá rẻ như này cũng ok rồi,1
đúng với mô_tả đúng,1
màu_sắc trăng,1
e e e s to s t do y v vi o_o uy i d si di dy d,1
chất_liệu ok,1
lần sau sẽ tiếp_tục ủng_hộ shop nhé,1
nói_chung là hàng chất_lượng,1
đẹp nhưng_mà hơi mỏng so với giá tiền cũng hợp,1
ok,1
chất_liệu nhẹ tốt,1
đúng với mô_tả đúng,1
y_hệt hình nha mọi người,1
đúng với mô_tả đúng,1
sẽ tiếp_tục ủng_hộ shop,1
mùi hương ổn n,1
chất_lượng sản_phẩm tốt,1
đúng với mô_tả đúng sp,1
chất_lượng sản_phẩm tốt,1
săn đc đ nên tạm bỏ_qua giao hàng nhanh nha,1
đúng với mô_tả tốt,1
video và hình_ảnh kh lq ạ,1
"mèo nhà em đã ăn được cơm , hạt",1
"shop tư_vấn nhiệt_tình lắm nha , mình od tai nghe mà shop gửi nhầm cái là shop gọi giải_quyết cho mình luôn",1
"chất liệuổn , hơi thừa chỉ",1
cũng hợp vs giá tiền,1
"chất_liệu vải mỏng , in đẹp",1
"nó hơi đậm so với tưởng_tượng , nma với cái giá này là hợp_lí rù ii",1
đúng với mô_tả đúng,1
đúng với mô_tả đúng,1
"dép đẹp , nhưng có đường chỉ thừ a , và đế hơi đục k đc trắng như hình , cân_nhắc trc khi mua",1
màu_sắc ok,1
thấy shop cũng nhiệt_tình hàng ok,1
tai nghe phù_hợp với giá tiền,1
sản ph ấm tốt đúng với mô_tả giao hàng nhanh dễ lắp để nạng đc,1
đung s với mô_tả của shop,1
đúng với mô_tả đúng mỗi_tội em đặt si de hơi bé nên hơi tiếc hàng oki ship thân_thiện iu shop,1
"chào_mừng bạn đến với khay nhớ tạm của g boa r d , bất_kỳ văn_bản nào bạn sao_chép sẽ được lưu tại đây",1
shop gói hàng cẩn_thận,1
với gia k thi qua là toet với mình ko biết san phi sip như_thế_nào có ai chi cho mình với,1
ok shop,1
giao hàng rõ nhanh ngày sau đã nhận được rồi ạ,1
ship e r giao hàng nhanh,1
đúng với mô_tả đúng,1
chất_lượng sản_phẩm tốt,1
đẹp cực luôn ý d b d k sn s s k sn s s k b d s sb d h,1
"túi xinh , kích_thước như mô_tả , đựng vừa điện_thoại , ví , thêm mấy đồ linh_tinh nữa",1
chất lg sản_phẩm tạm ổn thời_gian giao hàng nhanh_chóng shop phục vuu tình nói_chung là suy_nghĩ trc khi mua nha vải mỏng với ngắn,1
cg đc á ae mua ik tuy mỏng nhưng mặc ik chs ik hc là hợp_lý á,1
đúng với mô_tả đúng,1
màu trầm nhẹ_nhàng thoải_mái đi làm đi học,1
"giao hàng n h anh , chất_lượng tốt , shop khoan mấy cái lỗ cho mình có hơi lệch nhưng vẫn ổn",1
"dép rất đẹp , giao hàng n h anh , mình mới đặt hôm_qua mà h nay đã có ruii , săn với giá k mà kh làm mình thất_vọng",1
màu_sắc đúng,1
chất_lượng sản_phẩm tốt,1
đúng với mô_tả đúng,1
chất_lượng sản_phẩm đi như hình uy_tín,1
sản_phẩm tốt,1
d ngay,1
hàng rất đẹp và hạnh_phúc la e vui roi a ăn cơm chưa e ngu co tiên tra cho thăng giang ho d tôi chỗ lâm chua e đi làm gì vậy tướng ngu roi a ăn cơm chưa e ngu co tiên tra cho thăng giang ho d tôi chỗ lâm chua e đi làm về không_gian của các bạn có_thể kiêm_nhiệm chức_năng sinh lời hiệu_quả của các bạn trẻ_em mất_ngủ,1
quà tặng kèm chỉ là vài cái dây_thun đen lần đầu_tiên mình nhận được quà như_vậy nên hơi bất_ngờ,1
com em be vo uc he r,1
phần eo váy hơi bị rộng luôn á hu huu,1
chất_liệu tốt,1
vải tốt,1
chất_liệu tốt,1
hình in khá rõ nét,1
đúng với mô_tả đúng nhe,1
đúng với mô_tả đúng,1
tốt,1
"hàng đóng_gói cẩn_thận , tặng cả hay_là nhầm_lẫn túi đựng ma u , hàng dùng tạm ổn , chất_lượng hơi kém nhưng k thì okk nha , mn nên test",1
chất_lượng sản_phẩm mình nhận dc hàng rồi,1
đúng với mô_tả đúng,1
độ lưu hương tiếng,1
yêu shop,1
mn mua thử của shop đi ạ,1
chất_liệu tốt,1
ai sạch_sẽ ưa giữ_gìn lên mua mn ơi,1
sản_phẩm tốt,1
đúng với mô tải a_ha h,1
hàng đúng với anh,1
"bù lại dép rất xinh nha , mình đặt cỡ ban_đầu đi hơi chật nhưng về sau nó sẽ rộng ra dần",1
đóng_gói cẩn_thận,1
cảm_ơn shop,1
chất_liệu tốt,1
