text,label
sp tốt giao tầm tuần tại hàng qte,0
mn nên mua nha hình_ảnh mang tính_chất minh_hoạ,0
h h d d s s d d h s h d d s s h s h s s d d,0
đã nhận đx hàng dép đẹp giá rẻ nhưng về dép bị móp méo đi mấy hôm rồi vẫn vây,0
chất_liệu cao_su,0
đúng với mô tảo k,0
chất_liệu vải,0
bây_giờ có rất nhiều người đeo dép cao_su,0
đúng với mô_tả dung mo ta,0
chất_liệu cao_su,0
hộp hơi bị móp,0
công_dụng me ku p,0
chất_liệu k biết,0
được nha mn do săn sa le có k à gói hàng kĩ mà lúc mở ra thì thấy hơi cũ còn bị mủm vài chỗ cũng tạm đc ạ,0
sợ đẹp đánh_giá sao,0
"mề m , m ịn",0
độ bền màu chưa dùng nên chưa bic,0
màu_sắc giống với mô_tả,0
nhma bị mẹ phát_hiện nên cho sao thôi nha,0
màu_sắc màu be,0
đánh_giá sao,0
màu_sắc g cy cy c t c,0
chất_liệu da pu,0
màu_sắc giống với hình_ảnh,0
đúng với mô_tả cũng giống dép,0
đúng với mô_tả đúng v,0
mới nhìn thì rộng mà mang vô vừa in,0
chất_liệu cotton,0
đúng với mô tảo k,0
chất_liệu sắt,0
nhưng loa hơi è,0
chất_lượng sản_phẩm d d,0
êmm lắm,0
ca ngày,0
màu_sắc đỏ,0
chất_liệu gió,0
"xin loi , thue bao cua quy khach chua du dieu kien ung tien do dang no cuoc dich vu",0
chất_liệu tót,0
chất_liệu da,0
chất_liệu vải,0
mình đặt mà shop giao nên đeo hơi bự,0
đúng với mô_tả dép đúng màu,0
đúng với mô_tả đúng vs mô_tả nha,0
đúng với mô tảo k,0
em chắc gì sạch bằng cl an bên chị nhất cái miệng,0
g,0
đúng với mô tảr,0
orm áo không quá rộng như trong đánh_giá,0
chất_lượng sản_phẩm có hỏng mất bên tai,0
chất_liệu đ c,0
"m , kg mặc vừa người",0
mình tưởng là ở ngoài sẽ không phát_âm nhưng phát ra âm rất to người ngoài vẫn nghe được,0
đáng_giá tiền,0
go o d,0
đúng với mô_tả không,0
màu_sắc den hong,0
đúng với mô tảo k,0
vs k thì khá oki r mà chất hơi mỏng thui,0
đúng với mô tản hận đúng sản_phẩm,0
ai có nhu_cầu thì nhắn_tin trực_tiếp alo,0
chất_liệu cao_su,0
mua giá k cứ nghĩ chắc kh có mà ai_ngờ có thật,0
"nhiều bạn cmt áo mỏng lộ này_nọ nhưng kiểu vải nó như_vậy chứ ko phải do mong đâu nha , mình có_thể mặc áo quây bên trong nếu sợ lộ",0
đúng với mô tảo k,0
d k d cc d d n d_din n k d dien v n k v n v n k n n,0
mỗi_tội mình đi giày sie mà mình đã đặt lùi sie r mà vẫn bị rộng,0
k s k s s d d n d n d n n d b d n n d n d d n n d n d n d n d,0
"phần eo rộng phải ik chiết , váy đc lớp g g b b h h",0
đúng với mô_tả ui,0
chất_liệu da,0
màu_sắc trắng tuy hơi bẩn nhưng đánh được,0
"chất_lượng sản_phẩm đẹp lắm nha nhưng lắm hơi b lâu thôi , đóng_gói hơi sơ_sài lúc mình nhận về bên ngoài nó rách nữa cơ",0
bin nhanh hết nghe không hay nghe em rất chập_chờn không bắt được sóng,0
chất_liệu sị n,0
pa ge,0
orm kg,0
kh đc màu đen n nhưng k như_vậy cx đc,0
chất_liệu cũng được,0
màu_sắc đúng vs mô_tả,0
màu_sắc trắng_tinh hơn video nhé,0
đúng với mô_tả b br dsg,0
màu_sắc đúng màu,0
đúng với mô tảo k,0
màu_sắc trắng gấu,0
điểm trừ là dây nối với máy_tính hơi ngắn,0
đúng với mô_tả ko,0
túi ở dưới đáy bị lỗi như g vẫn còn vớt_vát lại đc tí,0
hàng hơi rộng,0
mới về test thì nghe được cả tai,0
v x hon x hi xo s d b c i s h dy diu l h n v x g n x h di y uon cx m c b l hi dy a e y i dy yo h h cl gut u day e d g x g k ch gu p dt hg x m ch v n c b n,0
chất_liệu da,0
chất_liệu cao_su,0
chất_lượng sản_phẩm ni c e,0
đúng với mô tảo ke e,0
đi d sks,0
công_dụng tô_son,0
chất_liệu da,0
túi khá nhỏ trông không được chắc_chắn như trên mẫu chụp nhưng với giá vậy thì cũng không mong_đợi nhiều,0
ko ko ko ko ko ko ko ko kon kon o,0
chất_liệu vải,0
chỗ cổ áo trong có bị lỗi xíu nhưng được che bằng cổ áo ngoài nên chắc không ai biết,0
đáng_giá sao,0
áo_dài hợp với ng cao hơn ạ d s d v v g va x c g,0
sản_phẩm này có_thể làm được hong a di đà đi làm về ch ăn gì chưa anh ơi nó không có đi học về rồi anh ạ ạ đi ạ em cảm ô t to em có gì nha tại vì em không biết làm gì đâu có đâu mà không ạ ạ a nặng_nề nhất là bạn của em là người ấy là người biết_đâu có biết_đâu á e có làm gì đâu à kk ưt và các cháu đ,0
đá rơi hơi móp nhưng khắc_phục được,0
mn nên lùi s để vừa với chân mình hơn,0
mình đặt túi quai xách nhún nma shop hết hàng gửu mk mẫu túi mà mk cũng đang có ý_định mua,0
chất_liệu da,0
bình h luận n này y để kiếm m xuu hoi i nha a,0
chất_liệu cao_su,0
chất_liệu không dày cũng không quá mỏng,0
mận khía xào gừng,0
đúng với mô_tả si e,0
chất_liệu cotton,0
cái này cũng bình_thường nhưng pin thì cx hơi nhanh hết,0
chất_lượng sản_phẩm g hg,0
đúng với mô tảo k,0
chất_liệu d c,0
tôi biết đến anh thông_qua những bộ phim mà anh đóng,0
chất_liệu vải,0
đúng với mô_tả y e s,0
công_dụng đánh mỏ,0
chất_lượng sản_phẩm chưa dùng nên chưa biết,0
tuy hơi nhỏ nhưng phù_hợp với giá tiền,0
đúng với mô_tả ch x,0
mình đặt đơn rồi i nha a,0
tai nghe đeo lâu bị đau tai,0
chất_lượng sản_phẩm bình_thường,0
abc n d nsnd s d d,0
chất_liệu áo hơi mỏng,0
kèm cả dây sạc,0
đúng với mô_tả không,0
dv,0
chất_liệu đ c,0
đúng với mô_tả tạm đc,0
cl an bên chị méo có đụng bên cl an bên em,0
chất_liệu,0
màu_sắc be,0
ôk lắm nhà,0
chất_liệu vải,0
vải áo rất mỏng luôn ý nma tạm ổn trong tầm giá_như này y,0
độ bền màu chưa dùng chưa bt,0
đúng với mô tảo k,0
độ lưu hương ch k dùng nên chk bt,0
cx đc mang lên mua,0
n,0
cut e,0
chất_liệu vải da,0
chất_liệu cao_su,0
tính_năng nổi_bật loa rè,0
màu_sắc giống hình,0
màu_sắc xanh rêu,0
k k x k d k d,0
"vỏ_son đẹp , nhưng_mà hơi trầy lớp vỏ_son v kệ sao",0
hình_ảnh mang tính ch â p d nhận xu thông_cảm nha x mn c k v gs n c i v s k s cx n s c i sn h,0
ca đêm,0
lắp xg khá chắc_chắn nhưng nó hơi lệch chút,0
"có sản_phẩm bị hư cái tai thỏ , không lên_đèn được , còn lại thì ok",0
dép đẹp nhưng khi khui hàng trên dép có vài vết b nhưng tẩy được,0
giao hàng nhanh hôm là nhận được hàng r,0
đúng với mô tảo k,0
"đẹp , nhưng hơi to",0
dùng tốt cho hỏi shop một_chút làn út nguồn nó bị mà khó bấm vậy mong shop p rep p,0
mùi hương hơi nồng nha mọi người,0
chất_liệu vải,0
tấm mình chụp gần đúng màu áo hơn tấm mình chụp cả áo vì bị cháy sáng nhẹ,0
tiền nào của đấy thì không dám đòi_hỏi nhiều ạ,0
lh đ,0
cung,0
kg sie m eo hơi rộng nc ổn so với giá,0
chất_liệu cao_su,0
r g g b t g có_thể làm ra giấy kiểm_định chất nhận được nhiều đứa trẻ bị sốt có_thể,0
chất_liệu vải,0
"qergtuiopasdhklyxcvbnm ,",0
đúng với mô_tả đúng nhm hơi chật,0
có vài miếng gỗ bị bẩn hoặc bị sứt ở đầu,0
đúng với mô_tả có,0
chất_lượng sp tạm,0
vẫn còn vài chỗ bị dính keo,0
màu_sắc giống mẫu,0
màu sắc đen trăng,0
chất_liệu cx tốt,0
"ct áp_dụng khi nạp tiền vào tài_khoản viễn_thông qua thẻ at m quốc_tế , ví điện_tử có liên_kết trên my viet tel",0
chất_liệu,0
chất_liệu da,0
độ bền màu,0
chất_liệu n h,0
"dép đẹp ok , mà e mua dép có gầu , lại giao dép trơn",0
chất_liệu da mem,0
chất_liệu k biết nữa,0
màu_sắc den,0
đúng với mô tảo k k,0
đúng với mô_tả không biết,0
đúng với mô tảo k,0
đúng với mô_tả dung d s,0
đúng với mô_tả giống với hình,0
đúng với mô tảđ,0
chất_liệu cao_su,0
đúng với mô tảo k,0
chất_liệu d c,0
chất_lượng sản_phẩm không biết,0
đúng với mô_tả đúng với màu_sắc,0
đúng với mô_tả đúng giống như ảnh,0
đúng với mô_tả đẹp nhưng s ti c ke r hơi dễ tróc,0
công_dụng làm môi đệp hơn,0
"em nói em ko tiếc , nhưng anh lại rất tiếc",0
chất_liệu vải,0
cx ổn,0
t,0
t,0
đúng với mô_tả không,0
nhưng_mà đeo lâu đau tai ạ,0
màu sắc đen thi đúng rùi,0
chất_liệu da,0
nói_chung là sao,0
màu_sắc d p,0
hàng chất_lượng nghe hây là giao lạ,0
chất_liệu kh biet,0
đúng với mô tảo k,0
đúng với mô tảo k,0
màu_sắc giống hình,0
chỗ nghe hơi nhỏ so với tai thằng bạn,0
ọk,0
giáo_dục và đào_tạo r ạ được k ạ em lượn sóng_gió của con gái hhk,0
mùi hương chưa nhận đc hàng,0
mau bay,0
đúng với mô_tả g x g xut xut d r y si h,0
anh năm nay tuổi và tham_gia hoạt_động giải_trí năm,0
đúng với mô_tả đẹp và dày và đi thi k lắm,0
chất_liệu đ c,0
nắng ấm xa dần khép lại khi em đã xa rồi mùa đông ấy đã cướp đi sinh_mạng của t với thằng bạn thân của mình thì ai cũng có_thể nói là ông lên tầng xuống tạp_chí play bo y bị chồng đánh_đập dã,0
phần âm_thanh tai nghe khá ổn so với giá tiền nhma phần mic của tai nghe thì có vẻ hơi rè và khó nghe,0
màu_sắc xanh be,0
k nên ko đòi_hỏi nhiều,0
độ bền màu tạm,0
độ lưu hương giờ,0
c,0
độ bền màu ko lì,0
kết_cấu nhỏ gọn,0
đến bây h em vẫn chưa nhận đc hàng,0
kha ôn hơp vơi gia_tiên nho gon dê xai,0
màu áo hơi khác so với hình của shop,0
ổn thôi nha nó rộng mà ngắn như áo í nhm dưới mét chắc đc nhm ú tí chứ gầy thì ko mặc đc,0
hàng hoàn nên ko có ảnh,0
dép đi êm rẻ nhưng mới_đầu có mùi nồng nhưng sài lâu sẽ ht và dép hơi to nhưng giá có k thì k đòi_hỏi nhìu,0
đúng với mô_tả đúng nha mấy cha,0
màu_sắc ảnh,0
mùi hương cx đc,0
đèn mở k lên,0
chất_liệu vải,0
chỉ được mỗi_cái đúng kích_thước và giao hàng nhanh,0
đúng với mô_tả tạm,0
mình thí c màu nâu hơn nhưng đặt nhầm,0
lh đ,0
chất_liệu d c,0
đúng với mô_tả khoong,0
chất_lượng sản_phẩm d c,0
chất_lượng sản_phẩm gỗ gì á ko bt,0
đúng với mô_tả rộng hơn,0
áo tạm ổn nha với giá chưa tới k thì cũng đc cầm cũng nặng_tay hh hình_ảnh chỉ mang tính_chất nhận xu,0
h s hi b b d d n n d d n n,0
hàng quốc_tế nên giao hơi lâu màu đẹp được,0
đúng với mô_tả đúng vs miêu_tả,0
màu_sắc trắng đúng với mô_tả,0
chất_liệu len,0
chất_liệu vải,0
chất_liệu da,0
nhưng cũng chấp_nhận được,0
cái áo nó chạ có rì nếu nó ko quá ngắn so với mình,0
"đúng với mô tảk đúng , dép trơn k có hình con gấu trên quai dép",0
màu_sắc xanh,0
chất_liệu vãi cat on,0
giao hàng nhanh cái khâu chuẩn_bị hàng chậm nhé,0
công_dụng đánh môi,0
chất_liệu tạm,0
n tham_khảo thử nha,0
đ,0
chất_liệu cao_su,0
thôi,0
anh ship hàng cs tâm m,0
chất_liệu giống ảnh,0
g dy dt d n dt d m h k n g x d h s ht dy k cy dt xy k dt dy k ky s t d h k di d ky k dt i d ku r sy y k du l dit dy ky k d k d d koi xu k,0
"hàng giống hình o k , nma mình muốn góp í cho shop xíu là , đừng để dép vào bị khi giao hàng vì điều đó khiến cho dép mất phom á , vì dụ kh đóng_hộp thì có_thể để miếng giữ phom dép cho đẹp , chứ k và đóng bị thì mất om cái gãy om cái xấu lắm , may là mình có săn đc k nên điều cũng bỏ_qua đ c , mn nên tăng lên sie nha",0
hàng được đóng_gói kĩ_càng và cẩn_thận nhưng điểm trừ là hàng bị hỏng nha cụ_thể là ở từng góc_cạnh của kệ thì bị bong và không được chắc_chắn như trong ảnh,0
hàng về trong vòng ngày,0
"hơi mỏng , có một_ít chỉ thừ a , nhưng cũng được hợp với giá tiền , hình_ảnh chỉ mang tính_chất nhận xu",0
tính_năng nổi_bật bình_thường,0
nói_chung phù_hợp với giá tiền,0
chất_liệu,0
mới nhận hàng,0
"vỏ bên ngoài bị móp mé o , nhưng k ảnh_hưởng đến tai nghe nên ks , chưa dùng nên k biết chất_lượng thế_nào",0
đúng với mô tảo k,0
đúng với mô tảo k,0
chất_liệu da có ngọc_trai,0
"dép vừa a_sai , giao n h anh , sao nhâ",0
màu_sắc t rắn h,0
chuẩn sie lông ít mỏng nhanh bẩn,0
chất_liệu vải,0
đẹp nhưng hàng bị bung ra một tai,0
còn chân m dạo này đen nên đi màu trắng vào ko ngửi dc chả dám đeo,0
"nhìn số tiền là biết rồi , khóc trong lòng",0
đúng với mô tảo k,0
màu_sắc den,0
đúng với mô_tả y e s,0
chất_liệu ha,0
chất_liệu vải,0
nam e o san an ai mi ga mam a to ya t te im as u vol,0
k x k x k x,0
mua thì mua k mua thì mua,0
m,0
màu_sắc đúng màu,0
màu_sắc trắng_trơn k giống hình,0
đúng với mô tảo k,0
chất_liệu da,0
chất_liệu da,0
đúng với mô_tả si e hơi nhỏ,0
màu_sắc giống ảnh,0
không biết có đổi trả được không,0
đúng với mô tảo k,0
công_dụng_son,0
chất_liệu biet,0
gia_đình là thứ tồn_tại duy_nhất còn những thứ khác có hay không thì cũng không quan_trọng,0
màu_sắc cũng đ,0
với lap top thì mình chưa kết_nối được,0
dây hơi ngắn tý ạ,0
nhỏ mà được,0
chất_lượng sản_phẩm tạm ổn,0
màu_sắc xanh,0
chất_liệu vải,0
đặt đc với giá k cũng ko dám nói nhiều,0
đúng với mô_tả ko bt nx,0
"màu sắc đen_trắng , có hoạ_tiết",0
nhưng_mà chữ in bị làm_sao ấy nhưng_mà có mấy chục nghìn thôi nên kệ,0
chất_liệu cx đc,0
đúng mô_tả tuy_nhiên vải gió mỏng k được dày cho lắm,0
g g kh h,0
sp tốt ạaa hơi chật t,0
màu_sắc đ c,0
chất_lượng sản_phẩm nói_chung là tạm được,0
áo màu xanh chữ in hơi dễ tróc nên chắc chỉ dám giặt tay thôi chứ không dám giặt máy,0
chất_liệu silic on,0
chất_liệu da,0
chất_liệu da,0
đ,0
đúng với mô_tả y e s,0
n m ke nsnd v b lan d ne s s,0
m k x k x k s,0
hang qua tot,0
vải hơi mỏng,0
nhỏ gọn,0
ai iu h hy ge g d g d h d h b d b d h s he h s h s h s h d h s h d b h s h,0
chất_liệu u k,0
đúng với mô_tả dep hoi rach o cho con gau nhung hang van ok nha moi nguoi,0
chất_liệu vải,0
đúng với mô tản on o,0
lần sau sẽ ủng_hộ shop ti ê p hình_ảnh chỉ mang tính_chất minh_hoạ để nhận xu thôi,0
chất_liệu da,0
công_ty t n h h an bình đã thanh_toán tiền thuê bằng tiền gửi ngân_hàng,0
màu_sắc tưởng xanh đậm ai_ngờ xanh lá cây,0
đúng với mô_tả tạm,0
màu_sắc đung màu đen,0
"sản_phẩm ok nha , vì là hàng qu t nên giao hơi chậm tý",0
mang tính tính_chất đánh_giá lấy xu hàng săn seo cũng ok,0
"mùi cồn nồng , nồng hơn s him ang nhi ề u , cũng ok , giao hàng nhanh",0
chất_liệu da,0
"giao hàng n h anh , đóng_gói cẩn_thận , shop có nhét giấy bên trong để giữ dáng túi , nhưng cái giao cho mình hơi rối chỉ t ẹ o , cũng may ở mặt sau nên mình thấy cũng ổn",0
chất_liệu da,0
màu_sắc be_be be,0
kết_nối giữa hai tap hơi chậm,0
cx dc,0
chất_liệu k bt,0
độ bền màu ko lì như quảng_cáo,0
màu_sắc đúng màu,0
có đều vải hơi mỏng xíu,0
đúng với mô_tả u h,0
chất_lượng sản_phẩm tạm được,0
đúng với mô_tả vâng,0
"mình cao m , nặng kg mặc sie m bụng hơi rộng xíu xiu còn lại là vừa in nha",0
đúng với mô_tả áo mỏng,0
chất_liệu cao_su,0
chất_lượng sản_phẩm nhựa,0
tiền nào của đó nha,0
áo hơi mỏng với_lại có mấy vết dơ ở cổ áo nma vs giá tiền này thì mình ko đòi_hỏi nhìu,0
"cho e đổi lại đc ko ak , e lấy cỡ , hơi ngắn và chật ak",0
"nghe đc n hạ c , có leg xịn x g g h",0
hàng về được vài ngày rồi mà giờ mới có thời_gian đánh_giá,0
đúng với mô_tả tạm đc,0
eo váy hơi to và váy hơi ngắn,0
độ bền màu ăn xong vẫn còn lớp base nhẹ nha nhưng màu này để lại base nâu trên môi mình,0
phần_lớn k,0
độ lưu hương tầm h,0
n s h d h d bs h s s d d h d,0
"giá rẻ , đẹp nhg dép to ạ mùi ghê chết ạ , giao sai sie ạ",0
"mình đi sie nhưng sie này có_vẻ hơi rộng , mn nên chọn lùi về sie",0
chất_liệu cao_su,0
go o d,0
đúng với mô tản hận hàng hộ nên k bt,0
nếu mua thì mua á,0
tui sẽ để video cho mn nghe đoạn nhạc nha,0
đúng với mô_tả ch x đem về,0
sau ko biết thế_nào,0
đúng với mô_tả ko,0
"công_ty phân_bổ và tính giá_trị công_cụ xuất kho dùng cho thuê tính vào chi_phí quản_lý doanh_nghiệp trong tháng , bắt_đầu từ tháng này",0
công_dụng để bôi lên môi,0
chất_liệu nỉ,0
kiểu như nó đã cú bàn học mình khỏi cảnh bừa_bộn ấy nên đ luôn kk,0
màu_sắc hồng,0
tạm ổn h d h d he he he g,0
đúng với mô_tả_binh thuong,0
giá bán thì nhiều người nói_chuyện với ý tt,0
chất_liệu ai biết,0
go o d,0
hàng hơi mỏng_manh,0
đặc_trị mụn đỏ mụn viêm mụn bọc mụn dị_ứng,0
hơi lỏng_lẻo,0
hình_ảnh mang tính minh_hoạ,0
tai nghe ngoài hơi nhỏ thì tất_cả điều oki,0
nhưng hơi chật một xíu ko sao,0
"ổn , nhưng chất vải hơi giống áo nilong h ảnh chỉ mang tc minh_hoạ",0
màu_sắc den,0
dá vừa đủ,0
sie vừa người mình qua mông mình m kg,0
vì mua có k nê vậy cũng oke la rù ii,0
đeo vào cảm_giác mình cao lên vì độn phân,0
đúng với mô_tả đ g,0
hình_ảnh ang tính_chất nhân x,0
hà hc yd d,0
chất_lượng sản_phẩm cx đc,0
màu_sắc tình_yêu màu hồng,0
"its a am ai n g al tho u g h its cheap , it so un d s gr e at",0
chất_liệu k bt,0
chiêm_tinh_học phương tây đo,0
mình săn còn có k,0
chất_liệu cao_su hay sao ý,0
màu_sắc đúng màu,0
chất_liệu da,0
"nhưng có_điều , mình đã nói trước với shop là nhớ kiểm_tra phụ_kiện đi kèm , nhưng cuối_cùng shop vẫn quên",0
mận_cơm xào gừng,0
chất vải hơi mỏng nhưng đối_với giá thì ổn,0
vậy cũng không phải ai khác chính_xác hơn thì có_lẽ là một người_mẫu này là của ai cả đâu mà nói thật chứ mình không có tiền_án,0
màu_sắc trắng sữa,0
màu_sắc cũng được,0
shipper thân thiên,0
màu_sắc be,0
túi đẹp có ít chỉ thừa nhg ko sao,0
nếu bỏ tiền ra mua thì hơi phí,0
chất_liệu cao_su,0
đúng với mô tảo k,0
chất_liệu t,0
chất_liệu vải i,0
chất_lượng sản_phẩm khá ổn nhưng lúc mik nhận về thì tai nghe có vết trầy_xước khá nhiều,0
mau dê dép mũ đen phom đẹp,0
mùi hương nước_hoa cooc,0
chất_liệu bánh_mì,0
dùng ổn nhưng màu không được như mong_đợi,0
sp oke e hinh ảnh mang g tính_chất t nhân n xu ạhh,0
thời_gian sử_dụng cũng tầm ho u r s gì đó,0
chất_lượng sản_phẩm ổn_áp,0
"áo vải mỏng , áo không suông mà bó từ đoạn hông nên mình phải sơ vin",0
sẵn hàng sll cho các b đk,0
màu_sắc ch x đem về,0
"hàng tốt , giống hình , nghe ha y , mà đeo nặng_tai quá",0
"chưa xài nên chưa biết , nhma chắc được",0
chất_liệu da,0
chất_liệu vải,0
chất_liệu khá dày,0
go o g le dịch,0
hơn tháng r k giải_quyết,0
công_dụng_son,0
độ lưu hương chưa biết,0
độ bền màu ỏn,0
tuy nhien s nho qa,0
công_dụng_son môi,0
chất_liệu da,0
đèn,0
chất_liệu vải,0
đầu mũi dép hơi hẹp k đc đẹp cho lắm ở trung_tâm giữa bàn_chân thì ok hơn,0
"sản_phẩm nhỏ dành cho trẻ_em và cán bạn nữ trai ko hợp , mn lưu_ý tại nghe blu eto ot h đang kết_nối với đt thì sẽ ko tắt tai nghe blu eto ot h đc mn phải tắt blu eto ot h trên đt thì mới tắt đc blu eto ot h trên tai nghe",0
"như_vậy là tốt rồi , lần sau sẽ ủng_hộ shop tiếp tự chụp nên không được đẹp lắm , video mang tính_chất nhận xu",0
giày không có hộp nên bị mất rom,0
nói_chung là tạm ổn,0
lh d,0
hình_ảnh mang tính_chất minh_hoạ,0
mua hàng hộ nên không có ảnh,0
chất_liệu vải,0
đúng với mô_tả dúng,0
mỏng lắm nha,0
công_dụng_son môi,0
nếu_mà chọn đi cho vừa chân thì nên chọn to thêm cỡ,0
vài chỗ bị dơ,0
h h di d de i d n d di d d,0
đúng với mô tảo k,0
than k s shop,0
cái khớp lúc mới mở ra hơi sợ gãy xíu,0
m,0
de thuong dang iu cut e pho mai que hơi cứng xíu nma quá là rẻ,0
e h s k su r h h s,0
có chỉ thừa nhưng cũng ko nhiều,0
đeo lâu hơi đau tai,0
giao hàng siêu nhanh nhưng mình kh hài_lòng về thái_độ phục_vụ lắm,0
nen mua,0
màu_sắc giống hình,0
nhưng đi nhiều chải nhiều chắc cũng hết,0
đúng với mô_tả đúng như ảnh nhưng hơi rộng xíu ạ,0
độ bền màu trôi nhanh,0
đặc_trị mụn đầu trắng mụn trứng_cá mụn cám nám tàn nhan,0
lần sau nhớ đưa hướng_dẫn sử_dụng nhé shop,0
tai nghe ok bla bla bla x v x v x v x v x v x v x v x v x v x v x v x v x v x v x v x v,0
chất_lượng sản_phẩm k so oe i eo e,0
h d de k k s s d n xn n s s k s k n d n x d n d n xn d n d n d n d,0
đúng với mô_tả y e s,0
đúng với mô_tả có,0
chất_liệu vai,0
chất_lượng sản_phẩm cũng tạm,0
đúng với mô_tả không biết,0
chất_liệu da,0
đúng với mô_tả u k,0
"hình_ảnh chỉ mang tính_chất nhận xu , nhưng lời nhận_xét là thật lòng",0
mua mã kđ áp kèm chỉ k tại ht tp s,0
đúng với mô_tả mỏng in hình đúng,0
đúng với mô_tả hơi rộng,0
dù mình đã nhắn nhắc shop trước là giao đủ cho mình dây nhưng vẫn bị thiếu dây nối tay nghe với máy,0
shop đóng_gói cẩn_thận ship nhanh anh ship hàng chán luôn,0
"hơi cũ chắc do để l â u , gói hàng kĩ_lưỡng",0
k sn si h d bis,0
màu_sắc nhạt hơn so với hình shop chụp,0
độ bền màu nâu đất,0
công_dụng tô lên môi,0
độ lưu hương khoảng phút,0
màu_sắc đ c,0
đúng với mô_tả ý e,0
đúng với mô_tả ko bt,0
"nói_chung là tạm ổn , có chỗ bị bong ra trông không được đẹp nhưng dùng tạm",0
đúng với mô_tả tạm,0
đúng với mô tảb,0
"vải nóng chữ in đẹp nha , hình_ảnh mang tính_chất nhận xu thôi",0
ảnh mang tính chat nhạn xu,0
độ lưu hương m l,0
cho sao vì k tốt,0
công_dụng_son,0
hình_ảnh mang tính_chất minh_hoạ,0
k k k x k x,0
chất_liệu cao_su,0
màu_sắc đúng với mô_tả,0
"nói_chung ổ n , n ê n mua",0
tính_năng nổi_bật bình_thường,0
công_dụng_son môi,0
đúng với mô tảk giống hình lắm,0
đúng với mô_tả u k,0
cái đực,0
"hình_ảnh và video chỉ mang tính_chất nhận xu , ko phải đánh_giá sản_phẩm , mua được giá k tạm ổn",0
áo hơi mỏng xíu nhẹ_tay nma cũng tạm đc vid tiền_nào_của_nấy,0
màu_sắc hồng,0
sản_phẩm khá ổn tuy_nhiên vẫn có hỏng_hóc,0
chất_liệu cao_su,0
chất_lượng sản_phẩm tạm ổn,0
màu_sắc be,0
chất_liệu k biết,0
đúng với mô_tả hơi to,0
đúng với mô_tả đ r,0
màu_sắc ok tạm,0
chất_liệu bánh_mì,0
"hình in nổi nhẹ , vải có_thể bị xù lông",0
tai nghe tốt nha nhưng_mà nó bị sứt ra một bên rồi á nói_chung là cx tạm đc,0
có_thể gấp gọn lại được,0
tính_năng nổi_bật các ổ_cắm cũng như sd lỏng_lẻo dôm dựa,0
chất_liệu vải dù,0
chất_liệu cũng tạm đc,0
chất_lượng sản_phẩm chưa dùng thử v,0
"cả khá mỏng , nhìn_chung áo đẹp , mặc vào có hơi hầm chút",0
"tu choi qc , soan tc gui",0
s d ke sk kns ss,0
nghe được có bên thôi,0
lười chụp nên lấy ảnh đồ_ăn,0
màu_sắc xanh rêu,0
