text,label
chất_liệu cotton,0
điểm,0
"mua đii trong nhà hay ra ngoài đều được , vải kh bị xù lắm đâu u",0
chất_liệu cao_su,0
vải hơi mỏng,0
đỡ hơn màu đen nhưng mỏng hơn màu đen tí,0
xin k nha,0
dép đẹp nhưng hơi bị mất om,0
g đủ chun buộc tóc hàng cao_su nguyên_chất không sử_dụng cao_su tái_sinh ảnh_hưởng đến sức_khoẻ,0
đúng với mô_tả gần giống,0
hơi chật tý,0
chất_liệu cao_su,0
tặng kèm nước_chấm,0
nhưng để làm_sao tắt được đèn led,0
chất_liệu cao_su mềm,0
đúng với mô_tả không,0
chất_liệu cao_su,0
công_dụng tô môi,0
đúng với mô_tả ko,0
đúng với mô tảy hình,0
điểm trừ duy_nhất là cái dây đi kèm nó hơi chấm tí,0
hất lư on h h,0
tuy_nhiên mỗi lần kết_nối lại mới mở lên thì sẽ mất âm_thanh cỡ chữ,0
không có nút tắt đèn,0
hàng đc mỗi_tội chụp tai hơi bé,0
nói_chung tầm giá này thì cũng ko nên đòi_hỏi nhiều,0
vo lum e to,0
người ấy sẽ là ngườ,0
đúng với mô_tả sn,0
em hãy giao cho anh khoảng thời_gian còn lại nhé,0
độ bền màu chưa dùng nên chưa biết,0
đúng với mô_tả khá giống,0
đặt sie nhưng lòng dép om hơi nhỏ,0
chất_liệu da,0
chất_liệu vải,0
video đồ_là mik có bán nha mng ô ti kt ok mik sẽ thấy vào tcn mik là thấy b mik ạ hoặc kb alo,0
chất_liệu br h,0
đúng với mô_tả hơi mỏng,0
chất_liệu mình không biết,0
mình mua có mỗi k nên cũng ko đòi_hỏi nhiều,0
sản_phẩm o oke màu ht pin quá ak,0
chất_liệu k biết,0
"một bên to một bên nhỏ , với tầm tiền này thì vẫn ok",0
chất_liệu cao_su,0
chất_liệu giày dán nên hơi lỏng_lẻo,0
chất_liệu da,0
đơn hàng k,0
đúng với mô tảo k,0
d,0
chất_liệu vải,0
màu_sắc e,0
chất_liệu nhựa dẻo,0
đúng với mô tảo k,0
"hàng về sớm nhưng dép có cái vệt gì đó cứng đơ gỡ không ra , có mấy vết đen bẩn nhưng lau được , có vài chỗ bị hơi lõm lõm nhưng cũng nhỏ thôi không nhìn rõ",0
chất_liệu tạm đc,0
đúng màu,0
"giày đẹp giao đúng si e , nhưng k hợp với chân mình , mũi giày bị tróc da_màu trắng rồi",0
đúng với mô tảo ke e la,0
hơi chật,0
h,0
màu_sắc màu_sắc giống ảnh,0
chất_liệu k biet,0
thành_ra tai phon e của mình k có dây_cáp kết_nối lap top,0
công_dụng_son lì,0
chất_lượng sản_phẩm cx đc,0
tay_áo mình thấy hơi mỏng hay sao ấy,0
"độ lì tốt ,_son hơi vón cục với k đều màu lắm , kiểu bị dạng bột ấy , chắc dùng lâu sẽ quen",0
sản_phẩm giống qc,0
chất_liệu chun,0
chất_liệu da,0
đúng với mô_tả không,0
màu_sắc đ c,0
d,0
màu_sắc tạm ổn,0
màu_sắc trắng xanh,0
"oke nghe tốt và pin lâu nha , bị cái là hư đồ kéo tai nghe rộng ra bên",0
mới kết_nối thì hơi lác,0
đúng với mô_tả shop giao sai màu,0
đúng với mô_tả đú g,0
hơi chật ạ,0
đúng với mô_tả giống với hình,0
chất_liệu chat liệu đ ư pb g k l l k n v c,0
tôi rất thích cái gì cũng có giá_trị gì đâu bạn ah mà k có mà không biết có_khi còn bị nó lừa mình thấy,0
chất_liệu da,0
chất_liệu cung dc thoi,0
shop chăm_sóc khách_hàng với thái_độ chưa được tốt lắm còn chất_lượng sản_phẩm thì ổn,0
hàng oke lắm nha mm nhưng_mà hình dán hơi lệch,0
"n ,",0
hg d v k d b n k k d,0
"tại nghe hơi nặng , hàng rất đẹp như miêu_tả",0
"tử_vi năm , tử",0
k x k k x k s,0
a,0
đúng với mô tảo k,0
g ị c k v k v gìc g kh hi t,0
chất_liệu vải,0
màu_sắc xanh rêu đậm,0
nhẹ quá,0
chất_liệu cotton,0
mùi hương cooc,0
độ lưu hương giờ,0
độ lưu hương ch sử_dụng k bt,0
đúng với mô_tả có,0
"cả đều rất ít đỏ , có sắc n â u , nhìu hơn",0
một_hai ba bốn năm sáu bảy tám chín mười mười một mười_hai ba bốn năm sau,0
tính_năng nổi_bật tự_dưng vô_tình vào shop e e cái rước được cái loa k re sip tưởng ship trêu sp bừa hoá_ra loa thật,0
chất_liệu cao_su,0
chất_liệu,0
shipper,0
đúng với mô_tả có,0
ct,0
ik như hình_như nói_chung là sản_phẩm tốt,0
công_dụng đánh môi,0
đúng với mô tảo ko k,0
sản_phẩm giống hình nhưng shop giao thiếu dây kết_nối tai nghe với lap top,0
"màu hồng thơm nhất , màu cam thơm mùi keo , màu đen ít thơm",0
chất_liệu da,0
mùi cao_su hơi có mùi nồng_nặc nhưng vs giá tiền thì cx ok,0
thì cũng phải_biết suy_nghĩ thì sẽ có_thể là một trong những người yêu thích công_nghệ thì phải có cái gì,0
chất vải đẹp nhưng hơn rộ in g khi mặ lên nó cứ tụt xg shop nên lưu_ý nha,0
điểm,0
mình m kg mặc vừa chùm môn,0
chưa sử đụng nên chưa biết chất_lượng,0
đúng với mô tảu,0
tai nghe mình thấy nghe ổn nhưng đeo lâu thì đau tai nhé mn g g,0
độ lưu hương lưu tầm h,0
màu trắng nhám nha mọi người,0
công_dụng đánh_son,0
đúng với mô_tả đúng ich ang không khác chỗ nào hết,0
"công_dụng đánh_son , có_thể làm má_hồng",0
chất_lượng sản_phẩm tạm,0
công_dụng bôi,0
đúng với mô_tả cũng gọi là đúng,0
chất_lượng sản_phẩm cũng tạm,0
màu_sắc u k,0
váy đẹp nhưng hơi ngắn eo thì rộng quá tạm được thoi tiền nào của đấy,0
nhưng đường may thì hơi lõng liệu,0
tạm ổn,0
ng k nên mua,0
"túi xinh , dây ngọc_trai dễ đứt , phải tự xâu lại bằng dây_thép",0
mặc_dù bị móp chỗ nhưng thông_cảm được vì mik ở tận bình_dương lận,0
"tai nghe không xài được ạ , này mua đơn đầu_tiên nên cũng coi như là mua về trưng_bày cho đẹp thoi",0
chất_liệu cotton,0
túi giữ đc orm,0
bang ai trẻ_em,0
đánh_giá sao cho shop,0
hơi mềm kk,0
chất_liệu cao_su,0
kh có gì nổi_bật,0
g h hg xe v tb n n m,0
k d k d m d,0
hình_ảnh vs video không liên_quan nhưng_mà nên mua dép nha mn,0
màu_sắc xanh,0
mua ngoài phải hơn trăm_nghìn,0
cho điểm chắc cũng,0
đúng với mô_tả đứng,0
độ bền màu bình_thường,0
nói_chung là ổn lắm,0
tạm được ê h he he h he,0
"hơi có mùi hắc , dép k đc như trên hình n nói_chung là ổn",0
đẹp nhưng shop giao ko đúng sie đúng màu nha,0
chất_liệu lop,0
chất_liệu vải á tr,0
hình_ảnh chỉ mang tính_chất minh_hoạ dùng ổn,0
chất_liệu cao_su,0
tạm ổn nha chứ hơi mỏng xíu se le lên đ ổn nha,0
đúng với mô_tả áo lớp,0
chất_liệu tạm ổn so với giá tiền đó,0
tho hón sn sb ư h d ã h ko ne b d n k nẹc nẻ nè ne né nẻ,0
chất_liệu vải dù,0
đúng với mô_tả ko,0
"cảm_giác đau rát tức_thời tại vùng da chúng tiếp_xúc kèm theo ngứa rát nhẹ như bị trầy x ư ớ c , quan_sát kỹ thì bạn chỉ thấy chúng có một vệt dài , chứ ít lan sang các vùng da xung_quanh nên khá dễ phát_hiện",0
đúng với mô_tả ko,0
k thoi i mn ạ,0
"mùi cũng dễ chị u , ko quá nồng mùi cồn",0
sa le k ko thể đòi_hỏi thêm,0
mùi hương thì ra là thế_nào để tớ vào sau nhá hàng bằng cách linh_hoạt và sản_xuất khỏi,0
chất_liệu,0
chất_liệu gió,0
đúng với mô_tả màu giống,0
độ bền màu cũng tạm,0
màu_sắc xanh,0
"à mình cao m , nặng kg áo_dài đến mông n ka a",0
đúng với mô_tả chịu,0
đ cho shop p,0
cx đc sợ vs giá thị_trường thì ok,0
sản_phẩm đẹp rẻ đặt diễn nhưng giao si e nhỏ hơn,0
điểm trừ là phần eo ko có bóp dô nên nhìn như có bầu vậy át ui phải lấy kẹp tóc kẹp phía sau để chụp hình í,0
c minh_hoạ,0
đúng với mô_tả đúng màu với hình cỡ đúng tot,0
màu_sắc trà sữa,0
độ lưu hương tầm h,0
chất_liệu vải nỉ,0
giao hàng nhanh tầm ngày,0
dép đi êm nhưng hơi to ạ,0
màu_sắc xanh,0
chất_liệu da pu,0
âm_lượng thì ok mà tai nghe dc tai thì không,0
chất_liệu g,0
áo po lo trắng lo ui s he ar t hình,0
d,0
màu_sắc đe p,0
chất_liệu đúc,0
mình m nặng cân mặc vô thấy hơi rộng ở phần eo,0
màu_sắc đúng màu,0
đúng với mô tảk đúng vs mô_tả,0
hai,0
chất_liệu tốt cứng,0
áo mỏng sản_phẩm kém nhưng_mà k nên không đòi_hỏi gì nhiều,0
nói_chung mua được nhé,0
đúng với mô tảo k,0
chất_liệu,0
mik đặt c mà shop giao cs c may là shop cs tâm hoàn cho mk c nx,0
đúng với mô_tả ko biết,0
đúng với mô_tả hơi rộng,0
phần quai may dịch xuống dưới để hở ngón chân ra sẽ đẹ hơn,0
hơi chễ cũng ổn mẫu_mã đẹp kg do yd o y u l lu l lu lu d ly d l h h d kh d ky s ky h k x h l x h c k v x h m h cm b x g k x kh x,0
đúng với mô_tả cũng được,0
chất_liệu vải,0
màu_sắc đúng màu,0
chất_liệu vải,0
chất_liệu sốp,0
độ bền màu,0
chất_liệu cao_su mềm,0
"tai nghe đẹp , kết_nối nhanh nhưng cal l video bị de lay",0
giao đúng mẫu chỉ là lúc lắp lại có hơi nhìu bụi vs những lớp sơn hơi bị tróc xíu,0
đâu rồi em,0
chất_liệu,0
màu_sắc giống hình,0
sản_phẩm cũng tạm được có_điều hay bị mất kết_nối,0
chx nhận đc hàng,0
mp,0
"chất_lượng sản_phẩm cầm_chắc tay , nặng",0
chất_liệu silic on,0
công_dụng_son môi,0
đúng với mô_tả có,0
với giá này,0
p nhung có công mài sắt có ngày nào anh rảnh không,0
vận_chuyển rất là lâu ngày mới nhận đc hàng,0
vải hơi mổng nhưng với giá_trị k thì không có gì để nói hết,0
chất_liệu chịu,0
màu_sắc đên,0
giao hàng nhanh xin k,0
đúng với mô_tả y e d s d,0
đúng với mô tảo k,0
như hình,0
chất_liệu k bt,0
không biết dùng tim e sau có sao không,0
chất_liệu vải,0
chất_liệu k s k s k k s k s k,0
chất_liệu vải,0
độ bền màu,0
"sao đôi dép còn lại ko có con gấu , tôi ko đồng_ý nha , sản_phẩm cũng tạm , giao hàng n h anh , nhưng tiền ship hơi đỏ nha , shop coi lại chiếc dép",0
dính vào vụ này thì mình thấy nó cũng có_thể là do người ta không có gì là_lạ đâu,0
công_dụng đánh môi,0
đúng với mô_tả có,0
chất_liệu cao_su,0
đúng với mô tảo k,0
cho h l choc h,0
săn sa le với giá k mà sợ kh gửi hàng đi nhưng dép đẹp lắm hơi nồng mùi nhựa tí,0
mùi hương mình thấy thơm chứ không hắc như cmt,0
"hôm_nay , hlv mai đức chung đã có chuyến khảo_sát tại thành_phố dun e_din nơi diễn ra trận đấu cuối_cùng của đt nữ việt_nam tại vòng bảng vck ia o r l d cup nữ",0
tớ m kg mặc qua mông một_chút,0
mà giá vậy thì ok rồi trách ai bây_giờ khuyên là có tiền mua cái nào chất_lượng xíu đừng có như này nha hiu_hiu,0
"màu như hình kk , mình ko đòi_hỏi gì thêm",0
chất_liệu vải,0
rộng quá còn bị lỗi ko như mik nghĩ,0
"dép đẹp , nhưng chân mình nhỏ nên sie vẫn to , hình_ảnh chỉ mang tính_chất nhận xu",0
chất_liệu da,0
màu_sắc xanh,0
chất_liệu da,0
màu_sắc be,0
như cc,0
vải mềm ko mỏng cũng ko dày lắm,0
độ lưu hương cũng tạm,0
k mà nhức nách lun,0
"chất_lượng sản_phẩm tốt nhưng k giao đúng mẫu nên hơi thất_vọng nên mong shop lưu_ý giúp , sản_phẩm quay khi đã sử_dụng",0
chất_liệu vải,0
chất_liệu gió,0
đã nhận được hàng,0
k x k k x,0
k đúng với mô_tả,0
hàng giống ảnh,0
chất_liệu cao_su,0
chất_liệu cao_su,0
chất_liệu đ c,0
chất_lượng tốt nhưng anh ship giao hàng không tốt lắm,0
hơi bị mất orm túi xíu,0
i di d đ m,0
độ bền màu tô t,0
"giao hàng n h anh , vãi mỏng lắm nha , eo siêu bự mình săn giá k nên cũng tạm ổn",0
mận khía xào cay,0
hàng hơi bị cũ,0
chất_liệu da,0
độ bền màu b t,0
có kèm s ti c ke r k cắt sẵn,0
sản_phẩm dùng ok shop giao hàng khá nhanh nhưng nghe hơi nhỏ_xíu,1
đúng với mô tảk đc đúng lắm,1
hơi nhỏ với mình nma vẫn gấc tuyệt nha a,1
màu_sắc như hình,1
chất_lượng sản_phẩm tốt,1
chưa thấy bất_ổn,1
hàng chất lg l mn ạ nhma thiếu mỗi dây chuyển á sẽ có lần mua nếu hàng ko b trong ngày trc mua lần đc đúng ngày dùng b gãy,1
mua về mang liền quên e e d bac k,1
ok,1
chất_lượng sản_phẩm tốt,1
"nhất_định anh sẽ đối thật tốt với em , để em thấy bao mệt_mỏi , cô_đơn , thiệt_thòi , cay_đắng phải chịu những năm_tháng qua không còn quan_trọng nữa",1
áo có lớp nỉ dày_dặn,1
thời_gian giao hàng nhanh,1
chất_lượng sản_phẩm tốt,1
"xã_hội hiện_nay ngày_càng phát_triển về công_nghệ_thông_tin , xu_hướng toàn_cầu_hoá đẩy m",1
hàng giao nhanh mặc đẹp,1
rất đúng thời_điểm giao cho sao nhé,1
hàng ok lắm ạ,1
chất_lượng sản_phẩm tốt,1
đúng với mô_tả sản_phẩm đẹp,1
màu_sắc ok,1
chất_lượng sản_phẩm tốt,1
chi tiet lh d,1
màu_sắc đúng như trong hình,1
dép cao_su rất bền và chắc khó có gai mảnh sành đâm,1
có_vẻ ổn,1
chị mik cũng thích,1
bên ngoài đẹp còn khuyết_điểm là ko vừa vs lỗ tai chật l ạ xin cảm_ơn shop,1
vừa_vặn,1
rcm mn nên mua ạ,1
chất_lượng sản_phẩm tốt,1
đúng với mô_tả nên mua nka mn,1
màu_sắc đúng như hình,1
chất_liệu tot,1
đúng với mô_tả,1
đúng với mô_tả đúng,1
chất_liệu tốt,1
đúng với mô_tả,1
đúng với mô_tả đúng,1
đúng với mô_tả đúng,1
chất_lượng sản_phẩm tốt,1
độ lưu hương p,1
đúng với mô_tả đúng,1
màu_sắc giong hinh,1
ship e r thân_thiện,1
áo hơi mỏng mặc mát,1
đúng với mô_tả,1
chất_liệu ok,1
độ bền màu tốt,1
đúng với mô_tả đúng,1
chất_liệu hàng ok,1
mình săn được k cũng quá là ok ko dòi hỏi,1
đúng với mô_tả đúng,1
hàng còn nguyên hộp,1
shop giao hàng nhanh tư_vấn nhiệt_tình,1
đúng với mô_tả đúng mẫu,1
màu_sắc đúng,1
màu_sắc,1
sản_phẩm như hình,1
đúng với mô_tả đúng với mô_tả,1
đúng với mô_tả đúng,1
giao hàng nhanh,1
dép mềm và đẹp lắm hình_ảnh và video chỉ mang tính_chất minh_hoạ,1
chất_liệu tốt,1
dép không bị gẫy orm nha,1
shop giao nhanh lắm ạ,1
sản_phẩm tốt sài được cmt chỉ để nhậ xu nha nhưng hàng tốt nên mua nha mọi người,1
giao hàng nhanh lắm,1
khá ổn,1
chất_lượng sản_phẩm ổn n,1
giao hàng nhanh,1
đúng với mô_tả đúng,1
màu_sắc xanh h,1
mình cao m mặc thì tới mông kh rộng như mình tưởng nhưng mặc vào cũn dễ_thương nói_chung là ổn hết t,1
hàng giao nhanh đúng mô_tả,1
đúng với mô_tả sẽ ủng_hộ,1
màu_sắc đúng màu_sắc,1
đúng với mô_tả đúng,1
áo_rộng hơn_nữa thì có_lẽ sẽ đẹp hơn,1
chất_lượng sản_phẩm tốt,1
"váy đẹp đúng với số tiền hơi mỏng và hơi rộng eo , eo mình bé ko biết mặc được ko",1
xinh lắm sẽ ủng_hộ shop tiếp nhé ạ hi ki ki ki i ki kiu k kh sb m b bs h sn n n b h h sn sn h n mm n s hac ca h n sn sn sn n,1
k biết sài đc lâu k nhưng với giá tiền này thì cx ok rồi,1
sp tốt,1
hàng okk không biết có phải là em cũng không có xe đi mua đồ cho,1
bn sáng bật ton e da không tẩy không nâng ton e,1
đúng với mô_tả đúng y hình,1
k tin săn k cái tai phon e này luôn ắ trùi,1
chất_liệu tốt,1
chất_liệu tốt,1
đúng với mô_tả đúng,1
tính_năng nổi_bật tăng độ cut e lun,1
còn ai muốn thoải_mái hơn thì mua loại to nha,1
đúng với mô_tả giống như hình mang êm nên mua dép này,1
đúng với mô_tả đúng,1
giao hàng nhanh,1
cũng ok ạ,1
chất_liệu ok,1
chúng_tôi đã nhận được tin nhắn của bạn và sẽ sớm trả_lời,1
siêu cut e,1
màu_sắc đúng,1
shipper thân_thiện,1
đúng với mô_tả,1
lúc đó tôi đã nhảy_cẫng lên vì sung_sướng,1
"đóng_gói ok , nhưng mở_hàng ra vẫn còn ít bụi gỗ",1
đúng với mô_tả đúng,1
với số tiền thì khá là okk,1
đúng với mô_tả hàng đúng mô_tả,1
nói_chung là đáng mua,1
chất_liệu tốt,1
bạn nào tầm mặc đẹp,1
chất_lượng sản_phẩm tốt,1
chỉ k dc lo mc hoa rẻ quá chòi rẻ,1
áo chuẩn orm chất vải nóng áo hơi nhỏ so với tui còn lại thì ok hết n sb s s,1
"shop gói hàng cẩn_thận , mùi nước_hoa rất dễ chị u , ko nồng hoắc cả , shop tư_vấn tốt nên cho sao",1
đúng với mô_tả đúng,1
sản_phẩm mới,1
k bt sao mua với giá k luôn,1
"do là áo ree sie nên vừa hy ko là hên xui , nhg mà nch là giống hình , chỉ là_hơi chật",1
giao hàng nhanh,1
chất_liệu tốt,1
hàng đẹp nha,1
đúng với mô_tả ảnh minh_hoạ đó là,1
đúng với mô_tả đúng với sự nói thật của shop,1
chi tiet lien he,1
chất_lượng sản_phẩm tốt,1
hơi bị bẩn một_tí nhưng không sao ạ,1
vải ko mỏng cx ko dày có ít chỉ thừa nhưng ko đáng_kể phần may chữ hơi dúm nói_chung là rất ok la nên mua thử nha mn,1
"sp phù_hợp vs giá tiền lưu_ý hình_ảnh , video mang t chất nhận xu",1
sản_phẩm y hình,1
nên tham_khảo,1
mình chỉ đợi ngày là hàng về nha,1
đúng với mô_tả khá,1
chất_lượng sản_phẩm tốt,1
chất_liệu ổn,1
chất_liệu ok,1
hợp vs da ngăm lắm ý,1
hàng cũng đẹp nhưng khao a còn hơi lỏng,1
túi hơi mỏng nhưng xinh lắm,1
giao hàng nhanh,1
đúng với mô_tả đúng,1
chẳng có ai vĩnh_viễn không_thể rời bỏ ai,1
hài_lòng,1
mỗi_tội vải hơi mỏng nhma mình mua có nghìn nên không đòi_hỏi gì nhìu ạ,1
shipper vui_tính,1
hàng giao nhanh chất lương,1
vải hơi mỏng nhưng mặc được giá cả hợp_lý giao hàng nhanh,1
"_son thơm mùi trái c â y , ko bị hắc",1
nghe rất êm tai mỗi_tội thiếu dây kết_nối với máy_tính thôi ạ,1
công_dụng đánh môi cho xinh h,1
hàng giao nhanh_chóng,1
chất_liệu tan,1
chất_lượng sản_phẩm tốt,1
đúng với mô_tả đúng,1
chất_liệu ổn,1
bạn em mua bên shop rồi nên giới_thiệu e mua a,1
chất_liệu hi,1
đúng với mô_tả đúng,1
độ lưu hương t,1
áo ok nha có s sẽ ok hơn mm n n,1
ncl mng nên mua nha,1
tính_năng nổi_bật không có,1
đúng với mô_tả đúng đẹp lâm lun đúng như ảnh đế cao cmm,1
mong rằng chất_lượng ok,1
đóng_gói sản_phẩm chắc_chắn,1
giao đúng mẫu,1
đúng với mô_tả đúng,1
màu_sắc như hình,1
đúng với mô_tả đúng,1
chất_liệu mềm,1
chất_lượng sản_phẩm tốt,1
đúng với mô_tả đúng như trong ảnh,1
đúng với mô_tả đúng,1
chất_liệu ổn,1
mình thấy giao hàng rất nhanh,1
chất_liệu tot,1
đúng với mô_tả đúng,1
hàng về đúng ngày sinh_nhật mình luôn hi_hi,1
dép hơi có mùi nhưng đc đ nên rất là ok,1
đúng với mô_tả đúng,1
phần giao hàng gói kỹ ạ,1
tính_năng nổi_bật đèn sáng,1
sản_phẩm ok,1
gói hàng chặt_chẽ,1
đúng với mô_tả đúng,1
chất_liệu tốt,1
nhưng cũng xinh,1
chất_liệu ok,1
đúng với mô_tả,1
chất_liệu được ạ,1
đúng với mô_tả đúng,1
đèn chóp cũng ok lém,1
"đ hơi nghi_ngờ , nhưng khi nhận được hàng thì vui lắm nha",1
đúng với mô_tả đúng,1
mơ dẻo xào gừng,1
tính_năng nổi_bật loa to,1
gói hàng bên ngoài rất cẩn_thận,1
giao hàng nhanh,1
tb khuyến_mại ngày vàng,1
chất_liệu ok i,1
mùi hương nhẹ_nhàng,1
dép trắng đẹp mọi người ạ mình đeo rồi nên ko chụp được hình,1
đúng với mô_tả đúng,1
nghe ổn với k thì không đòi_hỏi quá nhiều về chất_lượng,1
"không dày cho lắm , phù_hợp mặc vào trời se lạnh , khi ship về thì có vài nơi bị bung chỉ , nhưng khong sao , mặc cũng đẹp",1
chất_liệu oke,1
độ lưu hương h,1
giao hàng nhanh,1
đúng với mô_tả đúng,1
test thử hàng ok,1
giao hàng nhanh,1
"giá rẻ , shipper hơi cọc xíu nhưng cũng do lỗi mình quên nghe đt nên ok , sp rất tốt",1
uy_tín,1
đúng với mô_tả đúng,1
chất_liệu vãi mềm,1
nên mua tăng sie,1
sản_phẩm đúng với mô_tả,1
giá thàng khá ổn so với cái loa,1
chất_liệu khá,1
ổn_áp phê t d,1
"may_mà tiếp the o , chúng_ta vẫn còn mấy chục năm",1
_son thơm mùi cam nhẹ ko hắc đâu,1
dép ko đc như mik nghĩ hàng thì về cx sớm nhma ko đc như mong_đợi,1
đúng với mô_tả đúng vs mô_tả,1
"tai nghe xinh xỉ u , tiếng to xỉu luôn , đèn cứ chớp_chớp như cây thông noel",1
sản_phẩm phù_hợp với giá tiền,1
chất_liệu tốt,1
"giao hàng n h anh , shipper thân_thiện , loa cx ổn nhưng nhỏ hơn mình nghĩ",1
sie chuẩn,1
chất_lượng sản_phẩm tốt,1
chất_liệu tốt,1
màu_sắc ok,1
chất_liệu tốt,1
đúng với mô_tả tốt,1
sản_phẩm cũng tốt nhưng hơi to nên đeo hơi đau tai,1
tính_năng nổi_bật nhỏ,1
đúng với mô_tả đúng,1
đầm rất giống hình,1
so với giá thì sản_phẩm khá ok,1
"dép xinh lắm nha , mùi hơi khó_chịu xíu n h mà hong sao",1
màu_sắc ok,1
"túi ok nhưng chất_liệu không như mong_đợi , xem đánh_giá thấy chất_liệu da dày_dặn đẹp hơn , nhưng tổng_thể cũng ok",1
tính_năng nổi_bật cos đèn_chiếu ở tai mèo,1
chất_liệu chất_liệu tốt,1
tính_năng nổi_bật pin trâu,1
giao hàng nhanh ngày,1
"áo khá hợp orm , giá_cả hợp_lí , mỗi_tội chỉ thừa dễ bung ra phải khâu lại",1
màu_sắc ok,1
mua đc k nên cx vui kk,1
chất_lượng sản_phẩm tốt,1
có kèm dây để kết_nối mới lap top,1
nghe nhạc hay giao hàng nhanh,1
chất_liệu mềm,1
chất_liệu ok,1
mình dùng khá ok,1
màu_sắc ok,1
chất_liệu ổn,1
tính_năng nổi_bật ko,1
giao hàng nhanh,1
mng có_thể sd mic trực_tiếp từ lap top vẫn oke í,1
chất_liệu tốt,1
giáo hàng nhanh,1
chất_liệu ok,1
chất_liệu tốt,1
h cc y u h c v r r v b ky v t cx uu h vu v v ty,1
đúng với mô_tả đúng,1
đúng với mô_tả đúng,1
màu_sắc ok,1
chất_lượng sản_phẩm tốt,1
đúng với mô_tả đúng,1
có thêm miếng mút ngực nữa là hết nước chấm,1
"chất_lượng sản_phẩm tốt , mẫu_mã đúng theo hình",1
chất_lượng sản_phẩm tốt,1
hàng dep,1
"hàng ok , có_điều orm hơi bị nhỏ_xíu",1
màu_sắc màu đúng như đơn hàng đã đặt,1
đẹp y hình,1
vs giá này với mình là ok,1
độ bền màu khá,1
"giao đúng áo , đúng màu",1
vận_chuyển hàng nhanh,1
giá_trị thấp thì shop dễ_thương chút thì khách còn bỏ_qua,1
shipper thân_thiện,1
chất_lượng sản_phẩm tốt,1
đóng_gói cẩn_thận,1
mùi hương thơm ngọt,1
đúng với mô_tả đẹp như hình,1
màu_sắc dẹp,1
công_dụng làm_đẹp,1
đang đặt thêm cho ng nhà đi,1
mik sẽ còn ql ủng_hộ nha a,1
oke đó những chơi gam e nó hơi lạ,1
siu xin k luôn đệp lắm í,1
hình_ảnh mang tính_chất nhận xu sản_phẩm đẹp đúng,1
đúng với mô_tả đúng,1
dép đế cao_dày dặn nhma be vé đang iu trông buồn_cười lắm nch là giá này xinh q u ã i khỏi phải bàn ship thì chịu_khó chạy thẳng nhà ka ka,1
chất_liệu tốt,1
"màu_sắc áo ko có gì đẹp cả , quá là bình_thường , tiền nào của đấy , hàng ake nha",1
chất_lượng sản_phẩm tốt,1
vì săn k nên ko đòi_hỏi gì thêm,1
lần này đặt còn được tặng mã giảm_giá nữa,1
"túi đẹp , giá vừa túi_tiền hs , kb dùng thì như nào nhưng nhìn_chung khá ổn",1
giá lại còn phải_chăng,1
sản_phẩm ok,1
đúng với mô_tả đẹp,1
chất_liệu trơn mịn,1
"yêu_cầu nữ trên tuổi , chăm_chỉ , siêng_năng , cẩn_thận",1
chất_lượng sản_phẩm ổn,1
"mình kiện shop vì shop bán hàng xinh quá_trời xinh , mình chưa thấy shop nào bán rẻ n nay mà áo không sợi chỉ thừa ý",1
