text,label
chất_liệu êm,1
đúng với mô_tả đúng,1
chất_liệu tốt,1
đúng với mô_tả đúng với mô_tả,1
đúng với mô_tả đúng,1
"đóng_gói tạm ổn , chất vải mát nhưng hơi mỏng , tay_bo chun cũng oke lắm , dây buộc khá chắc_chắn , phần cổ hơi rộng nên buộc dây lại bị tuột vai áo phần khoét may ko đều nha",1
mình tưởng là mua k nên shop sẽ ko giao nhưng_mà giao hàng nhanh nha mn,1
đúng với mô_tả đúng,1
khá ok ki,1
dép hơi bé nhưng rất đẹp cho shop s,1
mang vào chân đẹp như mà do có dây nên lâu_lâu rơi chân ra ngoài kk,1
mình nhận được hàng rồi nha shop,1
đúng với mô_tả đúng,1
cho shop sao nha,1
hơi rộng tí nma hàng đẹp nên tha_thứ,1
đúng với mô_tả,1
sản_phẩm đúng như hình,1
đúng với mô_tả đúng,1
chất_lượng sản_phẩm tốt,1
"mặt ở nhà được nói_chung cũng là c em e r y nhưng nó lạ lắm , hợp với giá tiền đó",1
chất_lượng sản_phẩm hàng ổn,1
mùi hương c hi h b,1
đúng với mô_tả rất giống hình,1
đúng với mô_tả y é,1
chất_lượng sản_phẩm tốt,1
đã mua nhiều lần của shop,1
túi đẹp nhưng có mỗi ngăn ủng_hộ shop nha mọi người,1
đúng với mô_tả khá đúng,1
giao hàng nhanh,1
đóng_gói cẩn_thận,1
đúng với mô_tả đúng,1
mình mua đc giá k mà dép đỉnh vãi luôn í,1
đúng với giá_thành,1
áo đẹp,1
đúng với mô_tả tốt_đẹp,1
không đòi_hỏi gì thêm,1
đúng với mô_tả đẹp tv,1
âm_thanh ổn,1
sản_phẩm ok,1
đúng với mô_tả đúng mô_tả,1
giao hàng nhanh đóng_gói sản_phẩm hơi sơ_sài xíu dép mặc êm nhìn hơi lớn nhưng tui mặc cũng ổn đẹp đáng mua nha mọi người,1
em chưa test nhưng cảm_quan qua so với giá thì sp ok i e các bác ah,1
đúng với mô_tả đúng,1
cho shop,1
hàng tốt nhưng hơi bé chúc các anh ship cố_gắng trong công_việc và gặp nhiều may_mắn nhé đi đừng an_toàn,1
đúng với mô_tả đúng với mô_tả,1
chất_liệu tốt,1
ok nha mn,1
tb tặng giá_trị cho lần nạp thẻ đầu_tiên trên my viet tel vào chủ_nhật ngày,1
áo bình_thường cũng ổnn,1
độ bền màu không lì đâu nhưng_mà đẹp,1
"dịch_vụ miễn_phí của go o g le dịch nhanh các từ , cụm_từ và trang eb giữa tiếng việt và hơn ngôn_ngữ khác",1
"hiện_tại , chúng_tôi không ở đ â y , nhưng chúng_tôi sẽ sớm liên_hệ lại với bạn trong trường_hợp cần liên_hệ gấp bạn có_thể gọi đến tổng_đài để được hỗ_trợ tốt nhất",1
được cái giá rẻ,1
chất_lượng sản_phẩm tốt,1
đúng với mô_tả đúng,1
vừa chân,1
rất tốt nhưng hơi nhỏ nhe,1
đúng với mô_tả chính_xác,1
nhận hàng rất nhanh,1
xin chào thảo cảm_ơn bạn đã nhắn_tin,1
đúng với mô_tả,1
đúng với mô_tả đúng,1
đúng với mô_tả ổn,1
duyên duy yên n,1
sản_phẩm khi bôi lên khá khô màu lên cũng ổn nhưng cần me ku p kĩ khi bôi lên sẽ đẹp hơn nhưng không rõ xuất_xứ nguồn_gốc nên để mà mua thì nên suy_nghĩ thật kĩ nha,1
đúng với mô_tả đúng,1
đúng với mô_tả đúng,1
chất_liệu nhẹ,1
chất_lượng sản_phẩm tốt,1
chúc shop ngày tốt_lành,1
chất_lượng sản_phẩm sản_phẩm uy_tín,1
cảm_ơn shop nhiều ạ,1
chờ i ơi chờ mãi mới về,1
giao nhanh giao đúng lúc mik ở nhà,1
đúng với mô_tả đúng,1
"vải khá mỏng , k dà y , đầy_đặn như trên hình , mặc cho đỡ nắng thì cũng oke",1
"sản_phẩm giao nguyên_vẹn , không bị bể hay bóp_méo",1
độ bền màu cũng đc,1
đúng với mô_tả,1
chất_liệu tốt,1
đúng với mô_tả đẹp,1
cảm_ơn shop nhiều,1
shop chăm_sóc khách_hàng rất tận_tình,1
"mik mua dịp sa le nên rất rẻ , giao hàng nhanh đóng_gói kỹ với dép siu xinh luôn mà sie hơi bự xíu",1
đúng với mô_tả đúng,1
"dép đẹp , chất_lượng phù_hợp giá tiền , giao ngẫu_nhiên nên nhận được màu đen mặc_dù thích màu trăng hơn hu_hu",1
đúng với mô_tả đúng,1
đúng với mô_tả đúng,1
"do ni c k mới nên mua tai nghe chụp có k , dùng xong thời_gian thấy oke cực nhưng_mà có_điều đeo lâu hơi đau tai thui",1
đúng với mô_tả khá tốt,1
hàng chất_lượng tốt,1
"tai nghe xịn lắm hu h u , mỗi_tội t bật đèn k dc , chắc do ngu hu huu nhm khá ổn đó",1
đúng với mô_tả đúng,1
chất_liệu chất_liệu bền dẻo,1
sản_phẩm như mô_tả giao hàng nhanh đúng số_lượng mộ người nên thử,1
"cái màu này giống xanh dương nhiều hơn xanh lụ c , bụi chút , giao hàng thân_thiện",1
shop đóng_gói cẩn_thận,1
dép xinh,1
"túi_xách nhìn đẹp ạ , đóng_gói k bị mất rom túi , dây hơi dài ạ , hình_ảnh chỉ mang tính_chất minh_hoạ , nên mua nha mn",1
tính_năng nổi_bật có đèn,1
rất đẹp nhưng hơi chật một_tí thôi ko sao tại vì chân tôi hơi to xin cảm_ơn ạ,1
chất_liệu tốt,1
độ lưu hương tiếng,1
dép om sie,1
đáng tiền,1
chất_lượng sản_phẩm tốt,1
"shop bán quần chán quá , mà là chán cho cái ví tiền của mình ý , quần xinh giãy đành_đạch nha các bạn , còn có thêm giấy thơm với được tặng một đôi tất nè , giao hàng còn nhanh nữa cơ",1
chất_lượng sản_phẩm tốt,1
vẫn cho shop sao,1
giao hàng nhanh,1
chất_lượng sản_phẩm hiện_tại vẫn ok,1
"đùi to mông to lên video nhìn hơi thô chút , nhưng ở ngoài xinh lứm",1
chất_lượng sản_phẩm tốt,1
màu_sắc trăng,1
chất_liệu tốt,1
hợp với giá tiến,1
chất_liệu tốt,1
đúng với mô_tả đúng nha,1
hàng đẹp nhưng vải thì k được đẹp cho lắm nhưng_mà đẹp po đỉnh h,1
giao hàng rất nhanh n s ti k cd e y uu h de ư ơ u g d dy ub cd r y ui h d r tu,1
chất_liệu tốt,1
màu_sắc đúng như mô_tả,1
giao hàng nhanh vải đẹp m mua sie l hơi dài nhưng không sao hàng ok chất_lượng uy_tín,1
chất_lượng sản_phẩm đóng_gói cẩn_thận,1
"giao hàng n h anh , sẽ t tục uhộ",1
chất_lượng sản_phẩm tốt,1
giao hàng nhanh,1
chất_liệu mềm,1
chất_lượng sản_phẩm dùng được,1
chất_lượng sản_phẩm tốt,1
"sản_phẩm ok , phù_hợp với giá tiền , giao hàng n h n h",1
ib để được giá tốt nhất,1
"sục đẹp lắm ạ , theo quan_điểm riêng thì em nghĩ nên đóng_gói vào hộp rồi bọc túi ạ chứ bọc túi không đến tay nó hơi bị móp vào ạ",1
giao hàng nhanh,1
chất_liệu ổn,1
đúng với mô_tả chuẩn,1
"than k s shop , mua được giá đ nên ko ý kiên i thêm",1
shop đóng_gói cẩn_thận ship hàng nhanh gon lẹ shipper nhiệt_tình chưa cui lên k biết mùi ntn,1
chất_liệu tốt,1
"chất liệumềm , dày",1
shop uy_tín,1
chất_liệu vải mềm,1
màu_sắc đúng,1
hàng v là ok,1
tính_năng nổi_bật mua tai nghe không dây giao tai nghe có dây,1
sẽ mua lại của shop này lần nx,1
"chất vải không dày cũng ko mỏng , màu áo đúng với mẫu",1
người giao hàng thân_thiện,1
hàng ok,1
đúng với mô_tả đúng,1
chất_lượng sản_phẩm tốt,1
giống như hình luôn,1
"tặng giá_trị tất_cả thẻ nạp trong hôm_nay , tiền km sử_dụng gọi , nhắn_tin nội mạng trong ngày",1
then kiu shop nha a,1
phục_vụ tốt,1
chất_liệu quốc_dân,1
hàng ok,1
"vải mỏng , nóng , ít lộ , tuyet voi i",1
túi đẹp như tấm ghẹo bà à ổn da báo_cáo chôn nên dễ bị rách nhưng nếu_như đừng sài để yên như shop giao tới là sẽ ko bị,1
đúng với mô_tả chuẩn,1
đúng với mô_tả đúng với hình,1
chất_lượng sản_phẩm đ c phù_hợp,1
chất_liệu cao suu,1
đúng với mô_tả đẹp,1
"nên mua màu đen vì vải mỏng ở phần bụng với phần eo hơi rộng , giá_như v là đẹp rùi giao hàng nhanh shipper thân_thiện",1
trả_lời tin nhắn rất nhanh,1
chất_liệu tốt,1
chất_liệu tot,1
"đẹp , nhưng hơi mùi và hơi dơ với k thì nên mua nha mn",1
đúng với mô_tả đúng,1
đúng với mô_tả đ c nên mua,1
tính_năng nổi_bật hai cái tai mèo,1
áo lên orm đáng rất đẹp nhưng_mà chất vải hơi mong nên dễ bị nhìn xuyên thấu,1
đúng với mô_tả đẹp,1
tính_năng nổi_bật ko,1
chất_lượng sản_phẩm tốt,1
áo phom hơi nhỏn hưng nói_chung hợp với giá tiền,1
đúng với mô_tả đúng với mô_tả,1
cảm_ơn shop,1
trôi khá nhanh h nha,1
"hàng rất đẹp , may là dùng được với máy_tính , không khác gì so với hình_ảnh minh họ a , không biết dùng được bao_lâu nữ a , mong là có_thể lâu_dài hình_ảnh chỉ mang tính_chất minh_hoạ",1
cảm_ơn shop đã tư_vấn nhiệt_tình,1
ai dè nhận dc cái vui ghê,1
giá tiền phù_hợp,1
màu_sắc trắng_tinh luon ạ,1
đúng với mô_tả,1
em bé_son thỏi này sẽ không làm nàng thất_vọng đâu nè,1
đúng với mô_tả đúng,1
đi mềm,1
khá cut e nha mn,1
b â h nan s sn s sn sn sn sn n sn sn s hy sb sb n,1
chất_lượng sản_phẩm tốt,1
shop giao thiếu mình dây kết_nối nhưng thôi k sao vì chất_lượng tai nghe quá ok,1
"chất_lượng của áo ổn , vẫn còn chút chỉ thừa",1
sẽ ủng_hộ shop,1
"hàng giao n h anh , dép ok có cái đổ lông quá",1
chất_liệu tốt,1
chất_lượng sản_phẩm phù_hợp giá tiền,1
sản_phẩm ok,1
sản_phẩm tốt,1
"áo lên orm đẹp lắm ạ , mỗi_tội là_hơi mỏng xíu",1
đúng với mô_tả đúng,1
mình vừa nhận được hàng,1
"dép đẹp , giống như ảnh , đi êm , ko mua thì phí lắm nha a",1
tính_năng nổi_bật đèn sáng,1
video chỉ có tính_chất nhận xu túi ok so với giá tiền lói chung là đỉnh h á,1
cut e lắm ạ,1
chất_lượng sản_phẩm tốt,1
hoặc in box nhật hào ngay để được nhận ư,1
hàng tuy về hơi lau nhưng khi mở hộp ra rất là ok luôn,1
"hmm áo đẹp có_điều mỏng đi_ngoài nắng sẽ thấy đc áo trong và cơ_thể ạ , nma được cái áo đẹp cx xinh còn hơi nhiều chỉ thừa nhưng so vs giá thì n cx đc cx tạm ổn",1
"chất_lượng sản_phẩm nhỏ nhưng có võ , âm_thanh cũng k phải to lắm đâu cũng vừa vừa thôi á",1
an thanh nghe ok pin sử_dụng lâu không yêu_cầu quá cao về sản_phẩm vì tiền nào của đó,1
đúng với mô_tả đúng,1
tư_vấn chu_đáo,1
kk xinh lắm m nha a tuỵ t lúm m ne k km m,1
"đúng với mô_tả ui i đẹp nhe e , orm ok k , vải trắng kh quá dày nên ra nắng hơi lộ xí u , nma kh vấn_đề , đâu ne , nchung là ưng ê he he h",1
"mở ra thì hơi mùi , bù lại dép đẹp vãi chưởng , s ti c ke r d â u , mừi điểm",1
shop ship hàng nhanh,1
độ lưu hương vừa_phải,1
tính_năng nổi_bật loa,1
chất_lượng sản_phẩm tốt,1
đúng với mô_tả đúng,1
"đẹp vừa_vặn , ổn , nhưng rất nồng mùi , rất khó chị u , nhưng tím lại sản_phẩm ok",1
kết_nối cũng xa,1
hợp giá tiền lên mua de e r đi hoặc mua loại giá cao hơn để chất_liệu tốt hơn,1
chất_lượng sản_phẩm tốt,1
"sản_phẩm tốt , dao n h anh , như tui đặc thì dao",1
so ciu than k s shop nhìu u se r vi c e tốt lun hi_hi hi,1
"cũng phù_hợp với giá tiền , kết_nối tốt",1
shop giao hàng nhanh đúng mẫu_mã,1
đúng với mô_tả đúng,1
cx ổn giao hàng nhanh vs giá tiền này thì cx khá ổn r hình in hơi ráp k bt giặt xong có bay hết k,1
độ lưu hương h,1
đúng với mô_tả chuẩn,1
"đi vệ_sinh cát đúng chỗ , sạch_sẽ",1
nhưng mè màu xinh lắm nhá si d b d,1
"shop tư_vấn nhiệt_tình , thân_thiện cự c , giao có hơi lâu so với dự_tính nhưng đang trong mùa địch và sau tết nên ko cảm đc",1
đúng với mô_tả tốt,1
chất_liệu ok,1
áo ổn với giá tiền mn mua nên cân_nhắc sie muốn rộng mặc xl,1
chất_liệu tốt,1
đúng với mô_tả đúng,1
chất_lượng phù_hợp với giá tiền,1
ban_đầu hàng có bị lỗi nhưng shop rất nhiệt_tình giúp mình đổi lại cái mới,1
đúng với mô_tả thiết_kế đẹp,1
chất_lượng sản_phẩm ổn,1
chất vải đẹp mà_còn rẻ làm e bảo vs con bạn nó lại đánh cho vì k mua cho nó,1
"giao hàng n h anh , sp hợp với giá tiền , hàng lúc nhận đc hơi bị móp méo tí",1
tính_năng nổi_bật có đèn nhấp_nháy,1
đúng với mô_tả đúng,1
màu_sắc màu trắng cx đẹp nma mik thi k màu đen hơn,1
chất_lượng sản_phẩm tốt,1
chất_lượng sản_phẩm ổn,1
sp tốt,1
đúng với mô_tả,1
nói_chung là oke,1
đúng với mô_tả hình đẹp,1
sản_phẩm tốt,1
đúng với mô tảy chang,1
đúng với mô_tả,1
dép đẹp,1
chất_lượng sản_phẩm tốt,1
tính_năng nổi_bật có đèn led,1
chất_liệu da mềm,1
chất_liệu vải dày_dặn,1
mùi hương dịu,1
dép đẹp được cái_là hơi lớn so vs chân mình,1
"dép đẹp , hoạ_tiết khá dễ_thương , mình đặt nhầm sie to nên khi mang vào nhìn như cái thuyền",1
màu đẹp bền nhưng rom không được đẹp cho lắm giao hàng nhanh giao đúng màu anh giao hàng đáng yêu thân_thiện ai muốn đeo rộng lên đầu lên s,1
đúng với mô_tả,1
chanh xả,1
đúng với mô_tả giao nhanh với_lại giá_cả bình_dân nữa,1
chất_lượng sản_phẩm,1
dép đi rất êm_đẹp,1
đúng với mô_tả đúng mô_tả,1
độ lưu hương ổn,1
đúng với mô_tả,1
yk hình,1
chất_lượng sản_phẩm tốt,1
shop bán rất uy_tín,1
độ lưu hương lâu khó bay mùi,1
chất_lượng sản_phẩm tốt,1
hàng hơi bé nhx đẹp đeo khá oke,1
đúng với mô_tả,1
giá k quá ổn,1
chất_liệu tốt,1
"giao hàng n h anh , đóng_gói cẩn_thận , mua acc mới nên có k à nên k đòi_hỏi nhi ề u , mới_đầu kh bíc sài tưởng nó bị hư tắt kh đc , nên mua nha mn , có mà sài lâu hơi đau tai",1
chúng_em đều cảm_thấy hồi_hộp vì tuy nghe tiếng đã lâu nhưng chưa ai được đặt_chân tới mảnh đất quê_hương cờ lau dẹp loạn này bao_giờ,1
chất_lượng sản_phẩm pha ke,1
chất_liệu ok,1
đúng với mô_tả đúng,1
nên mua mik đc mã giảm k nên k đắt nha rẻ lắm,1
chất_liệu tốt,1
mua với giá đ nên như này cũng khá ổn,1
chất_lượng sản_phẩm ổn,1
"nhg mặc thử thấy khá oke và mua vs k nx nên cg đc , giao hàng cg thân_thiện nên ko có buồn lắm cho sao",1
đúng với mô_tả,1
"mùi hương thơm nhưng mới xịt thì hơi gắt , để tầm s mới diệu lại , giá k đồi hỏi nhiều",1
sản_phẩm ok nhá,1
"cái kệ này mình mua hộ chị mình í , nên sẽ kh có video hay hình_ảnh gì đâu ạ",1
sẽ tiếp_tục ủng_hộ shop,1
chất_liệu tốt,1
chúc shop buôn may bán đắt,1
chất_liệu dày_dặn,1
màu_sắc đúng với hình_ảnh,1
màu sắc đen đẹp,1
giao hàng nhanh giá rẻ mỗi_tội bị mất nắp ở chỗ tai shop phục_vụ nhiệt_tình,1
mn lên mua nha,1
"chất_liệu khá nóng , nhưng với giá này thì cũng ok la",1
sản_phẩm tốt_giống hình_ảnh,1
sp cx ok đúng với hình minh_hoạ chỉ là mn mua thì mua rộng hơn chân sie nha mình đeo sie shop giao mà vẫn hơi chật nha,1
sản_phẩm oke trong tầm giá,1
"uk , m mac rong vai luon ae , cam on nha san xuat",1
nên mua hợp với túi_tiền,1
tốt,1
chất_liệu tot,1
đúng với mô_tả đúng,1
giao hàng nhanh_chóng,1
shop giao hàng nhanh đóng_gói cẩn_thận,1
màu_sắc ok,1
chất_lượng sản_phẩm tốt,1
nên mua nha nha mọi người,1
đúng với mô_tả đúng,1
màu_sắc đúng màu như trong hình,1
đúng với mô_tả đúng với mô_tả,1
"nói_chung là cũng ok e , phù_hợp với cái giá phải trả",1
đúng với mô_tả dung,1
chất_lượng sản_phẩm tốt,1
màu_sắc đúng,1
đúng với mô_tả hàng đúng với mô_tả,1
chất_liệu ok,1
đúng với mô_tả đúng vs mô_tả,1
chất_liệu nhua deo,1
đúng với mô_tả,1
chất_lượng sản_phẩm tốt,1
lông mềm mịn,1
tính_năng nổi_bật pin trâu,1
"chào_mừng bạn đến với bảng nhớ tạm của g boa r d , bất_kỳ văn_bản nào bạn sao_chép sẽ được lưu tại đây",1
dép đẹp,1
sẽ tiếp_tục ủng_hộ,1
vải tạm được nói_chung với giá tiền như_vậy là quá ok hàng giao nhanh nha,1
đúng với mô_tả khá đúng,1
ngon_lành cành đào,1
giá_thành hợp_lí,1
đúng với mô_tả đúng,1
áo chất khá ổn nhưng hơi mỏng,1
đúng với mô_tả đẹp,1
giày đẹp nha,1
chất_liệu tốt,1
ncl oki,1
ko bị hỏng hàng khi đến tay,1
"chất liệuđẹp , dày_dặn , không có chỉ thừ a , đúng mà u , nói_chung là ok",1
công_dụng đẹp môi,1
giá rẻ so với chất_lượng tốt như_vậy,1
màu_sắc ok,1
"áo mặc rất là v ừ a , mỗi_tội cái logo sau áo hơi để u , mặc rất mát vào mùa đông",1
xk ti cy oc p gu gi g h h hh o h hi gi gi gig gi gi g gg cc h h hhu u,1
đúng với mô_tả đúng,1
đúng với mô_tả chất_liệu đúng với mô_tả hợp giá tiền,1
êm chân,1
"chào_mừng bạn đến với bảng nhớ tạm của g boa r d , bất_kỳ văn_bản nào bạn sao_chép sẽ được lưu tại đây nhấn vào một đoạn để dán vào hộp văn_bản",1
sản_phẩm tốt,1
hàng đẹp giao hàng nhanh,1
hàng đẹp giao hàng nhanh tại vội nên không chụp áo được hu_hu hu h,1
shop giao hang g nhanh,1
đúng với mô_tả,1
n nên thử nha,1
để anh làm gì đó không phải là sao ạ em cảm_ơn chi_tiết mấy roi đó là nc ngoài_ra còn,1
giao hàng nhanh,1
tai nghe ok,1
đúng kiểu đúng màu luôn nha,1
chất_liệu tốt,1
đúng với mô_tả đúng,1
bán đắt nha shop ơi,1
đúng với mô_tả đúng,1
giao hàng nhanh,1
canh sa le được nên rẻ quá_trời,1
đế cao cm rep đi êm_đẹp hơn mong_đợi cảm_ơn shop nhiều ạ,1
đúng như hình,1
đúng với mô_tả đẹp,1
đúng với mô_tả đúng,1
đúng với mô_tả đúng,1
nhưng vì săn sa le đồng nên tha_thứ nhé,1
sp tốt,1
"mùi khá thích , lúc ban_đầu có mùi cồn khá nồng",1
sie trẻ_em hay sao bé xíu huu mọi người nên mua nha ủng_hộ shop,1
chất_liệu mềm_mại,1
hình_ảnh mang tính_chất nhận xu nhưng sản_phẩm khác tốt đáng để mua,1
tai nghe giống y hình minh_hoạ,1
"kết_cấu khá đặc , mướt",1
chất_liệu tốt,1
"hơi thất_vọng vì hàng về không phải mẫu trơn mà là em nà y , nhưng cũng đẹp lắm ạ",1
"tại săn sa le nên cũng rẻ , ko thể đòi_hỏi nhiều hơn ở shop",1
đúng với mô tảy hình giao hàng nhanh_chóng anh shipper thân_thiện,1
đẹp lắm đúng với hình_mẫu nhưng giao hơi lâu sẽ quay lại ủng_hộ tiếp,1
"dây không được dài như mình nghĩ , đúng mẫu , túi đẹp , giao nhanh",1
đúng với mô_tả đúng với mô_tả,1
hàng cũng ok lắm mọi người ạ,1
loa nhỏ nhưng_mà dùng rất tốt,1
chất_lượng sản_phẩm,1
sẽ tiếp_tục ủng_hộ shop,1
giao hàng nhanh,1
đúng với mô_tả chuẩn,1
"mỏng , một lớp , giá rẻ nên cũng chẳng đòi_hỏi gì cả , giao nhanh",1
đúng với mô_tả đúng với hình nha,1
chất_liệu tốt,1
đúng với mô_tả,1
đúng với mô_tả đúng,1
giao hàng nhanh đóng_gói cẩn_thận loa nhỏ gọn nma âm_thanh khá to mua đc với giá siêu hời nên kh có thắc_mắc gì nhiều hình_ảnh mang tính lượm xu,1
tính_năng nổi_bật có_thể tắt bật đèn rgb ở tai nghe,1
đúng với mô_tả đúng,1
đúng với mô_tả đúng,1
nói_chung là cũng ok,1
xịn xò,1
đi linh_tinh trong nhà thì cũng ok còn đâu là với giá tiền n vay k thể_nào muốn đẹp dc rồi,1
cho biết sinh nhiệt mol chuẩn thức của,1
đúng với mô_tả chuẩn,1
chất_lượng sản_phẩm đ ỉn k,1
săn đc còn k,1
đã nhận được,1
"tai nghe êm lắm , đẹp , lúc đầu chưa quen nên hơi đau tí , hàng giao hơi lâu do mình đặt ngay tết mak hông sao khuyến_khích cho shop sao",1
chất_liệu tốt,1
đúng với mô_tả đúng,1
đúng với mô_tả đúng,1
shipper nhiệt_tình,1
độ bền màu tốt,1
giao nhanh,1
so với thời_điểm dịch_bệnh như này thì shop giao thế_là quá nhanh rùi í,1
đúng với mô_tả đúng,1
đi êm chân,1
chất_liệu ok,1
đúng với mô_tả đúng,1
chất_liệu tốt,1
màu_sắc đúng,1
chất_lượng sản_phẩm tốt,1
giao hàng nhanh,1
ok,1
chất_lượng sản_phẩm tốt,1
đúng với mô_tả đúng mẫu ạ,1
cũng được vì giá tiền cũng hợp_lý,1
đúng với mô_tả dung,1
đúng với mô_tả đúng,1
đúng với mô_tả đúng,1
đúng với mô_tả đúng,1
chất_lượng sản_phẩm tốt,1
váy đẹp nhưng hơi rộng so với mình màu trắng cũng không mỏng đâu ạ mọi người nên mua,1
shop chuẩn_bị hàng nhanh,1
bũa sau đặt tiếp,1
đúng với mô_tả đúng,1
đúng miêu_tả,1
săn sa le giá k quá xịn n hu huu,1
chất_liệu tốt,1
đúng với mô_tả hơi lớn xíu nhưng cũng oke nha mn,1
đúng với mô_tả đúng với mô_tả,1
"hàng ok , ổn_định , kabakxbksaosmakxhslaxlxalxbslbalxbekxbienqixlnpnxlbxbx",1
đúng với mô_tả tốt,1
chất_liệu ok,1
màu_sắc màu đẹp,1
đúng với mô_tả đúng,1
tai bề bền bửa nhúng nước mà vẫn sài được,1
chất_lượng sản_phẩm tốt,1
dây sạc và dây kết_nối với máy_tính khá là ngắn nên mua nha mọi người,1
tính_năng nổi_bật nhỏ gọn,1
giao nhanh,1
k là quá đẹp h ch v cc bbc c g h h d s ty i p s x x v n n n ku r đe uo k b v c g v g b,1
màu_sắc ok,1
hàng oke lắm,1
"hang dung o k , dao hang nhanh chong giá_cả phai chang vua voi túi tien , lân sau ung hô shop tiep",1
lười nên k đánh_giá nữa,1
mùi hương ngọt,1
"thảm nhựa gai mít thảm gai đinh có tác_dụng chống trơn tốt phù_hợp trải hồ bơi , nhà_vệ_sinh , sàn sản_xuất , khu_vực chế_xuất , khu_vực chế_biến tại nhà_xưởng , nhà_hàng , khách_sạn",1
chất_liệu tốt,1
giao hàng khá nhanh,1
"đẹp , tiếng hơi rè nhỏ hơn con p cũ của mi k , có một cái dây bị lòi ra nhưng ko ảnh_hưởng gì nên ko quan_tâm lắm",1
đúng với mô_tả giống mô_tả,1
tính_năng nổi_bật ko có,1
tốt lắm á rất ổn mỗi_tội ko có giấy hướng_dẫn sử_dụng,1
đi êm chân,1
hàng rất ok k như_vậy cũng rất ngon tôi khuyến mọi người nên mua hình_ảnh chỉ mang tính_chất nhận xu,1
nói_chung cũng khá ok,1
"ê m có mua sách vs đi học văn koc hào mừng bạn đến với bảng nhớ tạm của g boa r d , bất_kỳ văn_bản nào bạn sao_chép sẽ được lưu tại đây",1
chất_liệu chất_liệu tốt,1
tính_năng nổi_bật tai mèo,1
chất_liệu vải mềm,1
chất_liệu chuẩn,1
hàng khá ok nhưng em không có thời_gian chụp ảnh với quay video shop thông_cảm o,1
đúng mẫu,1
đúng với mô_tả đúng,1
sản_phẩm khá được giao hàng nhanh có đồ sạc đầy_đủ nhưng_mà khi đeo hơi đau tai,1
tính_năng nổi_bật có đèn nhấp_nháy nì,1
_son lì ok lắm ạ mình test trên tay mà rửa rồi nhưng vẫn còn_son nè,1
độ lưu hương h,1
quả tại nghe xịn xò con bò đợi mãi shop mới sa le,1
đúng với mô_tả đúng,1
nhanh_chóng,1
mới mua nên mùi hơi khó ngửi nhưng dép đẹp lắm,1
"áo khá mỏng , màu áo như ảnh , dài rộng , mình m mặc dài gần ngang mông , mấy bạn dưới m mặc đẹp , giao hàng khá l â u , mua đc giá k quá hời nên ưng_ý k đòi gì thêm",1
đúng với mô_tả giống hình,1
đúng với mô_tả đúng vs mô_tả,1
đúng với mô_tả đẹp,1
giao hàng nhanh,1
chất_liệu da mềm,1
"một ngày nào đó trên thế_giới rộng_lớn này chúng_ta sẽ gặp được một người thuộc về riêng mình , một người bạn , một_nửa tâm_hồn , người mà chúng_ta có_thể kể cho họ nghe về những giấc mơ của mình",1
chất_lượng ổn,1
màu_sắc ok,1
hàng ok,1
